153	21.02.2024	ID2015315200	Sebastian Münzenmaier (AfD)	Sehr geehrter Herr Präsident! Meine Damen und Herren!  „Wir müssen eine weitere Zuwanderung aus fremden Kulturen unterbinden … Sieben Millionen Ausländer in Deutschland sind eine fehlerhafte Entwicklung, für die die Politik verantwortlich ist.“  „Wir dürfen nicht mehr so zaghaft sein bei ertappten ausländischen Straftätern. Wer unser Gastrecht missbraucht, für den gibt es nur eins: raus, und zwar schnell.“  Bevor Sie sich jetzt schon wieder aufregen oder dazwischenrufen, liebe Kollegen aus der SPD: Diese Zitate stammen nicht von AfD-Politikern. Das sind Zitate Ihrer Bundeskanzler, Ihrer SPD-Bundeskanzler Helmut Schmidt und Gerhard Schröder, meine Damen und Herren.  Während den Sozialdemokraten vor einigen Jahrzehnten also zumindest noch ein Stück Restvernunft geblieben war, sieht es heute ja ganz anders aus, wie wir jeden Tag hier erleben dürfen.  Um heute noch kluge Sozialdemokraten zu finden, muss man mittlerweile ins Ausland schauen, beispielsweise zu unseren dänischen Nachbarn. Dort geht die sozialdemokratische Regierung nämlich konsequent gegen Massenmigration vor, und der Staat löst mit entschlossenen und zielgerichteten Maßnahmen Problemviertel in Dänemark auf. Das klare Ziel der Dänen laut eigener Aussage: ein Null-Asyl-Land und ein Land ohne Parallelgesellschaften.  Als Transformationsgebiet wird in Dänemark ein Problemviertel definiert, wenn auf 1 000 Einwohner 50 Prozent Zuwanderer aus nichtwestlichen Ländern kommen und mindestens zwei von vier Kriterien – ein niedriger Grad an Beschäftigung, eine hohe Kriminalitätsrate, ein niedriges Bildungsniveau oder ein vergleichbar kleines Durchschnittseinkommen – erfüllt sind. Wenn das der Fall ist, müssen die Kinder in diesen Vierteln verpflichtend die Kita besuchen, um die dänische Sprache zu erlernen. Wenn Schulkinder dort mehr als 15 Prozent Fehlzeiten haben und Prüfungen schwänzen, werden die Sozialleistungen und das Kindergeld gekürzt.  Und bei Straftaten in Problemvierteln ist eine Verdopplung des Strafmaßes möglich. Der Mieterschutz für Straftäter entfällt, und sogenannte Angsträume werden dort sogar baulich aufgelöst.  Parallel dazu investiert Dänemark massiv in die betroffenen Bezirke, baut neue Bibliotheken, schafft Parks, renoviert Schulen und sorgt so dafür, dass sich die Dänen und die wirklich integrierten Ausländer wohlfühlen und davon profitieren, meine Damen und Herren.  Dänemark räumt also auf, und zwar mit Erfolg: Die Kriminalitätsrate und die Zahl der Problembezirke sind beträchtlich gesunken, Bildungsgrad und Beschäftigungsquote steigen stetig an. Und weil die dänischen Maßnahmen Sozialtouristen abschrecken, kamen 2023 nach Dänemark im ganzen Jahr so viele Zuwanderer wie nach Deutschland in exakt drei Tagen. Was in Dänemark selbstverständlich ist, muss auch in Deutschland selbstverständlich werden. Wer hierbleiben will, muss sich anpassen, und wer sich nicht anpasst, muss gehen.  Aber wenn ich mir Sie alle anschaue, dann denke ich daran, dass wir leider in deutschen Problemvierteln unter dieser migrationsbesoffenen Ampel das exakte Gegenteil erleben:  Arbeitslosigkeit, verwahrloste Hochhäuser, Messerattacken, Gruppenvergewaltigungen und Clankriminalität. Der Staat ist schwach, und die arabischen Clans bestimmen die Regeln. Vor den Spielotheken lungern jugendliche Straftäter,  die Parks sind mittlerweile kein Erholungsplatz für Familien mehr, sondern Rückzugsort für Drogendealer und Vergewaltiger. Deutsche fühlen sich fremd im eigenen Land.  Diese Zustände – da können Sie so viel reinrufen, wie Sie wollen – haben Sie alle, und zwar von der Linken bis hin zur CDU, zu verantworten, meine Damen und Herren.  Interessant ist ja immer: Wer leidet denn darunter? Das sind ja nicht Sie, wie Sie da sitzen, die verantwortlichen Politiker, die abgeschottet in den wohlhabenden Vororten leben und die Kinder auf Privatschulen schicken.  Die Menschen, die leiden, das sind die, die nicht so viel Geld haben, die den höchsten Preis für Ihre Multikulti-Träume bezahlen. Es sind nämlich die fleißigen Deutschen und die fleißigen integrierten Ausländer, die früh aufstehen, die zur Arbeit gehen, die Steuern zahlen und die es sich trotzdem nicht leisten können, ihr Viertel zu verlassen und in ein besseres, teureres Viertel zu ziehen. Deren Sicherheit ist gefährdet, jeden Tag. Diese Menschen leiden jeden Tag wegen Ihrer Politik. Diese sogenannten kleinen Leute, für die die SPD sich früher mal eingesetzt hat, hat die SPD mittlerweile aufgegeben; für die kämpft nur noch die AfD-Fraktion, meine Damen und Herren.  Wir haben mittlerweile in vielen Stadtvierteln unseres Landes Kipppunkte erreicht, die sich nur noch korrigieren lassen, wenn wir unverzüglich und konsequent durchgreifen. Deshalb kann ich Ihnen nur sagen: Folgen Sie unserem Antrag,  um nach dänischem Muster Parallelgesellschaften und Problemviertel aufzulösen und die Remigration illegaler Einwanderer umzusetzen!  Und bevor Sie gleich wieder alle hier am Pult durchdrehen und rumjammern und rumschreien und irgendwas von „Deportationen“ faseln oder mir erzählen, wie schlimm und menschenfeindlich die böse AfD doch sei: Schreiben Sie sich doch bitte die Worte des dänischen Justizministers Peter Hummelgaard aus Ihrer Schwesterpartei hinter die Ohren. Der ist nämlich für die genannten Maßnahmen mitverantwortlich und hat gesagt:  „Es geht … nicht darum, besonders hart zu sein. Unser Ziel ist, realistisch zu bleiben und ehrlich.“  Daran sollten Sie alle sich endlich mal ein Beispiel nehmen.  Ich danke Ihnen für die Aufmerksamkeit.  Vielen Dank. – Nächster Redner ist der Kollege Timo Schisanowski, SPD-Fraktion.
157	14.03.2024	ID2015707100	Sören Pellmann (Die Linke)	Herr Präsident, vielen Dank für diese Möglichkeit. – Gemäß § 31 unserer Geschäftsordnung gebe ich folgende mündliche Erklärung ab:  Die Petentin spricht mit ihrer Forderung nach einem Versorgungsausgleich für die in der DDR geschiedenen Ehen ein grundlegendes Problem unseres Rentensystems an: die gravierende Rentenlücke zwischen Ost und West. Im Zuge der Rentenüberleitung wurden ostdeutsche Rentnerinnen und Rentner stark benachteiligt. So wurden Umstände wie dem fehlenden Versorgungsausgleich nach einer Scheidung innerhalb der DDR keinerlei Rechnung getragen. Noch heute, über 30 Jahre später, führt dies zu überdurchschnittlich hoher Altersarmut in Ostdeutschland – ein Zustand, der absolut inakzeptabel ist, von der Regierung jedoch konstant wegignoriert wird.  Das zeigt auch und vor allem die Stiftung Härtefallfonds zur Abmilderung von Härtefällen bei der Ost-West-Rentenüberleitung für Spätaussiedler und jüdische Zuwanderer. Von den über 167 000 Anträgen auf Entschädigung, die bis zum 23. Februar dieses Jahres eingegangen sind, stammen laut der Antwort der Bundesregierung auf meine Anfrage hin 19,8 Prozent aus den neuen Bundesländern, einschließlich Berlin. Noch erschreckender ist aber: Von den Anträgen, die aus der Gruppe der Ost-West-Rentenüberleitung stammen, wurden gerade einmal 16,4 Prozent bewilligt.  Das zeigt klar und deutlich: Der Härtefallfonds ist eine Farce. Er ist zu bürokratisch, zu restriktiv und zu ungerecht. Er lässt ostdeutsche Rentnerinnen und Rentner nach wie vor im Stich und kann Anliegen wie dem der Petentin kaum gerecht werden. Daher fordern wir, Die Linke im Deutschen Bundestag, eine Lockerung der Kriterien für die Bewilligung innerhalb des Härtefallfonds, sodass endlich ein echter Gerechtigkeitsfonds entsteht. Außerdem fordern wir eine einkommens- und vermögensgeprüfte solidarische Mindestrente von 1 200 Euro für alle, damit keine Rentnerin und kein Rentner mehr von Altersarmut bedroht oder betroffen sein muss.  Wir als Die Linke werden uns weiterhin für die Interessen der ostdeutschen Rentnerinnen und Rentner einsetzen und nicht lockerlassen, bis hier endlich Gleichheit und Gerechtigkeit herrschen. Insofern halte ich das Anliegen der Petentin für begründet und überaus wichtig und stimme gegen den Abschluss des Petitionsverfahrens.  Vielen Dank.
160	21.03.2024	ID2016002500	Roger Beckamp (AfD)	Frau Präsidentin! Meine Damen und Herren! Die Union bringt ihren Gesetzentwurf zur Bezahlkarte für Asylanten ein, um – Zitat – „Anreize für die ungesteuerte Asylmigration nachhaltig zu verringern.“ „Verringern“, oder anders gesagt: drosseln, einschränken, absenken, mindern. Heißt das jetzt, dass Sie weniger Menschen aufnehmen möchten, als in unser Land kommen wollen? Aus unserer Sicht eine gute Idee. Aber was bedeutet das? Das heißt doch letztlich, dass Sie Millionen Menschen von unserem Land fernhalten wollen. Sie gehen davon aus: Die Bezahlkarte würde unzählige Menschen davon abschrecken, nach Deutschland zu kommen.  Mit einer Bezahlkarte sollen Asylbewerber einen Teil ihrer Leistungen als Guthaben vorrangig für Sachleistungen statt als Barauszahlung erhalten. Also: Verstehe ich Sie richtig? Sie als Union sehen das Motiv dieser Leute, warum sie hierher wollen, darin, dass es den Zuwanderern nicht um Schutz, sondern um freie Kost und Logis und üppige Sozialleistungen geht. So weit habe ich Sie richtig verstanden; denn ansonsten gäbe es ja keinen Grund, diese Menschen nicht ins Land zu lassen. Aber wenn es um ein angebliches Schutzbedürfnis ginge, wären doch alle willkommen. Richtig, oder? Wenn dann aber von denen, die Sie nicht wollen, weil es kein Schutz-, sondern ein Geldbedürfnis gibt, Millionen schon hier sind, darf man die dann wieder heimschicken? Wäre dann Remigration die richtige Maßnahme?  Also für diejenigen, die man nicht hier haben will, die Bezahlkarte, damit sie gar nicht erst kommen. Und für diejenigen, die schon da sind, aber keinen anerkennenswerten Grund für Asyl haben, die Remigration. Sie nennen das nur anders, zum Beispiel Rückführung, Abschiebung usw.  Habe ich es richtig verstanden, oder sind Sie doch für Masseneinwanderung, nur eben effizient und mit digitaler Begleitung und Bezahlkarte, also irgendwie: „Deutschland abschaffen – modern“?  Bezahlkarten und Sachleistungen, kein Bargeld – Sie sehen, ich finde die Idee ja grundsätzlich richtig. Allerdings verblüfft es mich dann doch wieder etwas, wenn man darauf schaut, was Sie in Ihrem Gesetzentwurf als Ziel fordern – Zitat –: „Anreize für die ungesteuerte Asylmigration nachhaltig zu verringern.“ Dann wäre etwa Folgendes eher naheliegend: keine Asylverfahren für Personen, die aus sicheren Drittstaaten einreisen, keine Asylverfahren für Personen ohne Identitätsdokumente, kein schneller Übergang von Asylbewerber- zu Sozialleistungen, keine freiwilligen Aufnahmeprogramme oder Familiennachzug nur für subsidiär Schutzberechtigte,  keine Heimatbesuche, Verlust der Asylberechtigung bei Besuchen im Heimatland – kommt zahlreich vor –, kein genereller Abschiebestopp nach Syrien oder Afghanistan, kein Einbürgerungsanspruch, stattdessen nur Ermessensentscheidungen, keine Unterstützung oder Duldung von Schlepperei als angebliche Seenotrettung.  Wenn dann doch jemand in unserem Land Asyl möchte, weil er vielleicht wirklich schutzbedürftig im Sinne des Asylrechts ist, dann prüfen wir das gerne. Dann erhält derjenige auch alles, was er benötigt, um seine elementarsten Grundbedürfnisse zu befriedigen, sich zu ernähren und sich zu waschen.  Es bleibt dabei: Es gibt unter den Zuwanderern sicherlich Millionen, die guten Willens sind, aber deren Fähigkeiten hier einfach nicht gebraucht werden und die schon gar kein Recht auf Asyl haben. Entscheidender Punkt!  Wir entwurzeln diese Menschen und gefährden unseren Wohlstand, unsere Sicherheit und unsere Lebensweise, unsere ganze Lebensqualität.  Und wir entwurzeln uns selbst durch millionenfache Zuwanderung, ganz zu schweigen von den Milliarden, die wir verschenken  und nicht den eigenen Einheimischen geben, die es verdient haben.  Als Nächster hat das Wort für die Fraktion Bündnis 90/Die Grünen Andreas Audretsch.
162	10.04.2024	ID2016209700	Martin Hess (AfD)	Herr Präsident! Meine Damen und Herren! Frau Schierenbeck, Ihre Aussagen belegen nur eines: Die SPD ist der Totengräber der inneren Sicherheit in Deutschland.  Unser Land darf man Ihnen nicht länger überlassen.  Die aktuellen Zahlen der Polizeilichen Kriminalstatistik für 2023 belegen ein kolossales Versagen der Bundesinnenministerin bei der wichtigsten Aufgabe des Staates, nämlich bei der Gewährleistung des Schutzes und der Sicherheit der eigenen Bürger. Der Dilettantismus, die Inkompetenz und vor allem die links-grün-rote Borniertheit der Ministerin haben dafür gesorgt, dass Deutschland so unsicher ist wie seit 15 Jahren nicht mehr.  Dieser Zustand ist nicht länger hinnehmbar und muss endlich beendet werden.  Die aktuelle Sicherheitslage ist geradezu schockierend. Die Zahl der Gewaltdelikte weist mit über 214 000 pro Jahr einen historischen Höchststand auf. Dabei liegt der Anteil ausländischer Tatverdächtiger bei 41,5 Prozent und ist damit fast dreimal so hoch wie der Anteil an der Gesamtbevölkerung.  Und der Anteil der sogenannten Zuwanderer beträgt mit 13,5 Prozent mehr als das Fünffache ihres Anteils an der Wohnbevölkerung. Während in diesem Deliktsbereich, Gewaltdelikte, die Zunahme bei den deutschen Tatverdächtigen nur 2,2 Prozent betrug, liegt diese bei nichtdeutschen Tatverdächtigen bei 14,4 Prozent und bei den sogenannten Zuwanderern sogar bei 20,3 Prozent  und ist damit zehnmal höher als bei deutschen Tatverdächtigen. Bei Mord und Totschlag ist die Zahl der deutschen Tatverdächtigen sogar um 1,4 Prozent zurückgegangen, während diese bei ausländischen Tatverdächtigen um 10,2 Prozent und bei Zuwanderern um 14,8 Prozent gestiegen ist.  Diese Zahlen lassen nur einen Schluss zu: Schuld an der Erosion der inneren Sicherheit, an immer mehr barbarischen Messerangriffen, an immer grausameren Sexualstraftaten und an immer brutaleren Körperverletzungs- und Raubdelikten in unserem Land ist der grenzen- und verantwortungslose Vielfalts- und Multikultiwahn dieser Ampelregierung.  Und deshalb führt an einer sofortigen Korrektur dieser verheerenden Migrationspolitik kein Weg vorbei.  Das Aussprechen dieser Tatsache ist weder fremdenfeindlich noch rassistisch, es ist einfach nur die Wahrheit. Also hören Sie endlich auf, die AfD und die Bürger unseres Landes für das Aussprechen dieser Wahrheit als rechtsextrem zu diffamieren! Wir wollen nur endlich wieder unser sicheres Deutschland zurück,  und dazu ist diese Ampelkoalition weder willens noch in der Lage.  Sie, Frau Ministerin Faeser, haben – und das beweisen die PKS-Zahlen eindeutig – die Kontrolle über die innere Sicherheit schon längst verloren. Und deshalb sind Appelle an Sie, endlich eine bessere Sicherheitspolitik umzusetzen, wie das die CDU/CSU immer tut, völlig sinnlos; denn Sie sind eine Überzeugungstäterin. Sie denken nicht im Traum daran, die verheerende Migrationspolitik zu korrigieren, weil Sie sie in Ihrem tiefsten Innern für absolut richtig halten, ganz egal, was es die deutschen Bürger an Leben und Gesundheit kostet.  An Überzeugungstäter appelliert man nicht, sondern man sorgt dafür, dass sie so schnell wie möglich ihren Ministersessel räumen müssen.  Immer mehr Bürger lassen sich von Ihnen nicht länger täuschen. Wenn Sie jetzt plötzlich sagen – Zitat –: „Wer sich nicht an die Regeln hält, muss gehen“, dann glaubt man, nicht richtig gehört zu haben. Der Bürger erkennt doch sofort dreierlei:  Erstens. Sie übernehmen schamlos eine AfD-Forderung,  die wir seit 2015 stellen. Bisher haben Sie jeden, der das so klar formuliert hat, in die rechtsextreme Ecke gestellt. Ihr Verhalten ist daher pure Heuchelei.  Zweitens ist die Aussage zwar inhaltlich richtig, sie ist aber nur deshalb erforderlich, weil die CDU/CSU in ihrer Regierungszeit und Sie eben jetzt durch eine völlig inakzeptable Migrationspolitik diese Gewaltverbrecher erst in unser Land gelassen haben.  Besser ist deshalb der von der AfD seit Langem geforderte Grundsatz: Wer sich nicht an die Regeln hält und illegal nach Deutschland einreisen will, kommt erst gar nicht nach Deutschland rein.  Und drittens hat der Kanzler im letzten Jahr bereits groß, medienwirksam verkündet, man müsse endlich in großem Stile abschieben. Passiert ist bis heute rein gar nichts. Deshalb ist Ihre Aussage auch nichts wert. Jeder Tag, den Sie länger im Amt des Bundesinnenministers verbleiben, ist ein schlechter Tag für Deutschland.  Und abschließend noch ein Wort an die Kollegen der CDU/CSU. Sie spielen sich ja auch heute wieder als Vertreter einer restriktiven Migrationspolitik auf.  Ich darf Ihnen mal in Erinnerung rufen: In Ihre Regierungszeit fällt der Anstieg der Gewaltdelikte im Jahr 2016 auf bereits 193 000. Ergo: Es war die CDU/CSU, die in einem unvorstellbaren Ausmaß Gewaltkriminalität nach Deutschland importiert hat. Davon hat sich unser Land bis heute nicht erholt. Ersparen Sie uns also zukünftig Ihre Doppelmoral, und hören Sie endlich auf, unsere Bürger für dumm zu verkaufen!  Vielen Dank. – Nächster Redner ist der Kollege Marcel Emmerich, Bündnis 90/Die Grünen.
162	10.04.2024	ID2016210100	Sebastian Fiedler (SPD)	Herzlichen Dank. – Frau Präsidentin! Liebe Kolleginnen und Kollegen! Das Thema wird teilweise ein bisschen unterkomplex behandelt, und dann setzen Sie bestimmte Schwerpunkte. Es ist wirklich schwer, in fünf Minuten alles zu adressieren.  Ich möchte einen Teil ganz gerne ansprechen, der mich schon ein bisschen überrascht. Wir sprechen über die Arbeit, den Arbeitsnachweis der Polizei von Bund und Ländern des letzten Jahres, und es ist noch kein Dank an all die Hunderttausenden Kolleginnen und Kollegen,  die in den Sicherheitsbehörden jeden Tag den Rücken krumm machen, gefallen. Diesen Dank möchte ich ganz gerne an den Anfang stellen.  Außerdem – Sie haben das gerade in Richtung der Bundesinnenministerin anklingen lassen, Herr Schuster – gehört es ja eigentlich zum guten Ton, dass die Sicherheitsbehörden Dinge kooperativ gemeinsam erarbeiten und bearbeiten. Die Innenministerkonferenzbeschlüsse sind, wie Sie wissen, einstimmig, die AG Kripo arbeitet zusammen, die Polizeibehörden des Bundes und der Länder arbeiten zusammen.  Deswegen: Wenn wir der Bevölkerung den Eindruck vermitteln, da gebe es insoweit Unstimmigkeiten, ist das schlicht die Unwahrheit.  Das hat ein Stück weit auch mit den Herausforderungen zu tun. Wenn ich jetzt nicht in diesen Arbeitsnachweis des letzten Jahres schauen würde – es ist interessant, dass Sie das in Zusammenhang mit der aktuellen Migrationslage bringen; die Statistik listet die Zahl der Straftaten aus dem letzten Jahr auf; zum Teil sind die Straftaten, die da drinstehen, noch älter –, würde ich zu folgendem Befund kommen, was die größten Herausforderungen im Bereich der Sicherheit sind:  Ich würde sagen: die Organisierte Kriminalität. Herr Schuster, Sie sollten es nicht ins Lächerliche ziehen,  wenn wir über eine Kokainschwemme in deutschen Großstädten sprechen, dass die Crackabhängigen für riesengroße Probleme sorgen  und wir große Sorgen wegen Fentanyl haben. Das ist etwas, worauf die Bundesinnenministerin zu Recht hinweist. Deswegen ist sie in den südamerikanischen Staaten gewesen und hat sehr gute Kooperationsabkommen geschlossen. Ich hätte mir gewünscht, Herr Seehofer wäre auch so viel in der Welt unterwegs gewesen.  Dann hätten wir da schon ein bisschen mehr erreichen können.  Die Organisierte Kriminalität ist eine sehr große Herausforderung. Europol hat uns gesagt: Wir haben es mit über 820 kriminellen Netzwerken der Organisierten Kriminalität zu tun. Da sollten Sie ganz ruhig sein: Sie wollen ja Europol gar nicht mehr haben. Denn ohne die Europäische Union würde es auch Europol nicht mehr geben.  Dann würde ich sagen: Cyberkriminalität. Bitkom spricht hier von Schäden in Höhe von 200 Milliarden Euro jedes Jahr. Nichts habe ich darüber gerade gehört, Frau Lindholz. Umweltkriminalität, das drittgrößte Phänomen, entzieht uns auf der Erde die Lebensgrundlagen. Wirtschaftskriminalität: Da haben wir sinkende Zahlen in der Statistik. Kinderpornografie: Zu Recht wird darauf hingewiesen, dass wir eine IP-Adressen-Speicherung dringend brauchen, so wie es die Bundesinnenministerin seit zwei Jahren fordert.  Und dann würde ich noch den Terrorismus nennen, der nicht Teil dieser Statistik ist, ebenso den Rechtsextremismus und, nicht zu vergessen, die Unterwanderung von fremden Staaten, unter anderem durch den Rubel, was die „fünfte Kolonne“ hier unter anderem auf meiner rechten Seite betrifft.  Das, würde ich sagen, sind die großen Herausforderungen im Bereich der Sicherheit, die wir gerade zu besprechen haben.  Warum steht das alles gar nicht in diesem Arbeitsnachweis?  Erstens betrifft er zu 95 Prozent die Arbeit der Länderpolizeien, die eine sehr gute Arbeit machen, zu der ich gerade schon etwas gesagt habe. Zweitens steht da nichts zu den Dunkelfeldern; das wurde auch schon gesagt. Wir haben es mit Kontrollkriminalität zu tun. Das heißt: Sinkende Zahlen der Wirtschaftskriminalität, der Korruption, der Rauschgiftkriminalität sind nicht etwa positive Entwicklungen. Die Polizei hat nur nicht so viele Delikte zutage gefördert. Auch politisch motivierte Steuerkriminalität steht da nicht drin.  Ich will Ihnen deswegen sagen: Weil das fehlt – das ist schon mehrfach angeklungen –, brauchen wir dringend eine andere Analyse, einen periodischen Sicherheitsbericht, der in Zukunft die Grundlage für eine andere Debatte, nämlich eine breitere Debatte liefert.  Das ist kein statistisches Spiel, sondern das erlaubt uns, besser hinzugucken.  Ich will Ihnen aber auch den Gefallen tun: Selbstverständlich müssen wir auch über nichtdeutsche Tatverdächtige sprechen; da beißt die Maus keinen Faden ab. Das ist auch kein neues Thema. Ich war Mitglied der Regierungskommission „Mehr Sicherheit für Nordrhein-Westfalen“ unter Leitung von Wolfgang Bosbach. Wir haben der nordrhein-westfälischen Landesregierung im Abschlussbericht 2020 aufgeschrieben, dass es dort eine Tätergruppe gibt, bei der die Zahl der Delikte von 2008 bis 2018 um 10 Prozent gestiegen ist, und haben einige Handlungsanweisungen gegeben. Das Kriminologische Forschungsinstitut Niedersachsen hat schon vor vielen Jahren darauf hingewiesen, dass es aus erklärbaren Gründen Zusammenhänge zwischen bestimmten Zuwanderergruppen und Gewaltkriminalität gibt. Diese kann man erklären.  Das hat nichts mit Rechtfertigung zu tun; denn es liefert uns Hinweise darauf, wie wir diese Straftaten besser verfolgen und diese Schwerkriminellen, die selbstverständlich außer Landes gehören, ausweisen können,  aber auch darauf, wie wir diese Kriminalität im Idealfall verhindern können.  Der Befund „Verhindern“ – das betrifft auch die Straftaten von Jugendlichen und Kindern – ist aber der Folgende: Gehen Sie mal in eine x-beliebige deutsche Großstadt, und fragen Sie in der Kommune: Welche Präventionskonzepte gibt es gerade bei Ihnen? Das wird schon die erste Hürde sein; denn Sie werden in den allermeisten Fällen erfahren: Das wissen wir gar nicht so genau; es sind verschiedene Träger. Wenn Sie dann fragen: „Welche sind denn gut und welche schlecht gewesen?“, kriegen Sie auch keine Antwort.  Das versuchen wir jetzt aufzugreifen durch eine neue Bundesakademie, die uns sagen wird: Wo gibt es gute Präventionsprojekte, und wo sind sie nicht so gut?  Diese zentrale Einheit als Bundesakademie – wir haben sie Gott sei Dank mit 200 Millionen Euro hinterlegt – bauen wir jetzt auf, weil wir der Kriminalität auf den Grund gehen wollen, um zukünftige Opfer zu verhindern.  Herzlichen Dank.  Das Wort hat die Kollegin Misbah Khan für Bündnis 90/Die Grünen.
