122	21.09.2023	ID2012207700	Dr. Gottfried Curio (AfD)	Sehr geehrte Präsidentin! Meine Damen und Herren! Hätte Innenministerin Faeser mal so viel Eifer wie bei der Entlassung Schönbohms in ihren eigentlichen Aufgabenbereich investiert, in Grenzschutz, innere Sicherheit, Abschiebungen, dann hätte Deutschland jetzt kein Aufnahmeproblem, Europa keine Migrationskrise, gäbe es die Bilder aus Lampedusa nicht. Denn es läge in ihrer Macht, dem Ganzen ein Ende zu bereiten. Die Migranten wollen vor allem nach Deutschland. Aber Faeser will schon wieder Solidarität zeigen, die Migranten aus Lampedusa aufnehmen. Wenn nächste Woche wieder eine Armada dort anlandet: Deutschland nimmt sie im Zweifelsfall – Frankreich übrigens nicht.  Deutschland sorgt dafür, dass der Strom nicht versiegen wird. Dabei hatte Deutschland letztes Jahr dreimal so viel Asylerstanträge wie Italien. Das muss wohl die vielgepriesene EU-Solidarität sein, die den schon am stärksten Belasteten zugunsten der anderen dann immer noch stärker belastet. Wir brauchen keine solidarischen Aufnahmen, keine europäischen Verteilungen, schon gar nicht die CDU-Frau von der Leyen, sondern Entschiedenheit. Niemand aus Innerafrika ist am Mittelmeer auf der Flucht. Deutschland passt flächenmäßig 85-mal in Afrika hinein, Afrika aber nicht in Deutschland. So einfach ist das.  Die Attraktivität Europas wird aber bleiben; denn das Gefälle des Lebensstandards wird bleiben. Lieber in Deutschland auf Stütze leben als in Afrika arbeiten.  Also heißt die Lösung, wenn die nächste Flotte von Wohlstandsmigranten in Europa einfällt: Gute Rückreise! Baut euch einen schönen Kontinent auf!  Deshalb sofort Stopp aller Programme, bei denen Deutschland selbst als Schleuser auftritt: kein Familiennachzug für illegale Zuwanderer. Der muss nicht in Deutschland stattfinden.  Die Sehnsucht scheint nicht so groß gewesen zu sein, als die Quartiermacher vorgeschickt wurden – von betuchten Familien übrigens, die sich Schleuserkosten und Lebensgefahr gerne leisten, um sich das später im Schlaraffenland Deutschland hundertfach zurückzahlen zu lassen.  Aus Nichtflucht-, sondern Transitländern wie Tunesien oder Türkei kann niemand aufgenommen werden. Kein Nigerianer ist in Tunesien auf der Flucht, kein Syrer, Afghane in der Türkei. Sobald diese Länder sich als Sackgasse herumsprechen, versiegt der Strom der Glücksritterkarawane sofort.  „Afghanische Ortskräfte“, ein pervertierter Begriff. Vielleicht gab es ein paar Hundert. Die Regierung erfindet 44 000  plus jedes Jahr noch mal 12 000 im Rahmen eines willkürlichen Aufnahmeprogramms. Alles überflüssig, Schluss mit dem ganzen Quatsch.  Wenn die polnische Regierung Hunderttausende Arbeitsvisa unter der Hand verkauft, Italien sich weigert, dort Erstregistrierte wieder aufzunehmen, wenn Griechenland angeblich nicht zumutbar ist, dann kann Schengen die Außengrenzen selbst nicht schützen. Deutschland muss selbst die notwendigen Schutz- und Kontrollmaßnahmen an seiner Grenze zumindest auf Zeit wieder aufnehmen.  Wer Abschieben nicht schafft, darf sowieso erst mal niemanden neu aufnehmen.  Stattdessen sendet Faeser aber ganz andere Signale: Chancen-Aufenthalt für Nichtaufenthaltsberechtigte, Turboeinbürgerung, sobald der Afghane die drei Buchstaben SPD lesen kann.  In Hessen ist die Verzweiflung so groß, dass jetzt sogar das Wahlrecht für Asylbewerber kommen soll. Mein Gott, wie peinlich ist das denn?  Den unhaltbaren Migrationszuständen verdanken wir explodierende Zuwanderergewalt: zu Silvester in Berlin, Zerstörungsfeste unserer Neubürger, Freibäder für Mädchen und Frauen nicht mehr betretbar, in den Innenstädten Clankriege,  Bandenkompromisse handeln Scharia-Richter aus. Wenn es wieder eine Schlägerei verfeindeter Ausländergruppen gibt, sagt Faeser irgendwo: Gewalt bei uns geht gar nicht. – Wenn wieder so ein traumatisierter Betreuungsfall unschuldige Menschen aufschlitzt, sagt sie: Wir brauchen wirklich mehr Sozialarbeiter.  Was wollen da alle Parteien außer der AfD? Weiter mit der Zuwanderung aus Nahost und Schwarzafrika. Die Ampel sowieso.  Die Union fordert Hunderttausende jährlich einfach als Kontingent.  Was für ein Wahnsinn, meine Damen und Herren.  Jetzt bringen Sie die hässlichen Bilder von 2015 in unsere Städte. Bahnhöfe, Parks, Schulen: immer öfter Angstzonen. Täglich Dutzende Messerattacken, zweimal täglich Gruppenvergewaltigung, Schwimmbadterror den ganzen Sommer durch, Schlägereien von Großfamilien in Dauerschleife.  Lübeck: Faesers Polizei will die Beweisvideos der Migrantengewalt unterdrücken. Stattdessen: für alle schnell Wahlrecht. Kein Politiker will diese illegalen Grenzübergänge stoppen außer die AfD. Wir sagen: Abschieben schafft Sicherheit. Wer Grenzen schützt, schützt Menschen.  Aber die Union will die verheerende Migrationspolitik von Ampel-Faeser gar nicht ändern. Sie will AfD-Anträge scheinheilig kopieren,  aber gleichzeitig die Ampelministerin Faeser behalten, wie sie uns gestern gezeigt hat. Man muss sich das mal vorstellen. Wer braucht denn so eine Pseudoopposition, die möchte, dass die Regierung im Amt bleibt?  Ihr Wähler der Union, ihr Wähler in Bayern, ihr Wähler in Hessen: Schaut auf diesen Saal und erkennt, dass ihr dieser Union nicht trauen dürft und nicht trauen könnt!  Herr Curio, ich entnehme Ihren Worten – wenn ich das Protokoll nachgelesen habe, werde ich mich gegebenenfalls dazu äußern –, dass Sie traumatisierte Menschen hier auf unflätige Art beleidigt haben. Das schaue ich mir nachher an und behalte mir entsprechende Maßnahmen vor.  Ich gebe jetzt das Wort dem Kollegen Dirk Wiese.
125	28.09.2023	ID2012506200	Peggy Schierenbeck (SPD)	Sehr geehrte Frau Präsidentin! Sehr geehrte Kolleginnen und Kollegen! Meine Damen und Herren! Im Gespräch mit Bürgerinnen und Bürgern erfahre ich immer, was sie bedrückt. Das ist unterschiedlich: im ländlichen Raum, in der Metropolregion. Was sie vereint, ist der Wunsch danach, dass wir handeln. Dass wir handeln, dass wir Dinge auf den richtigen Weg bringen, hat gerade erst die Bertelsmann-Stiftung bestätigt.  Als pragmatische Politikerin benenne ich die Themen, die im Raum stehen. Es freut mich daher, dass ich heute hier als Innenpolitikerin zur aktuellen Migrationslage sprechen darf. In ihren Anträgen fordert die AfD wiederholt ein konsequentes Handeln seitens der Bundesregierung respektive unserer Innenministerin Nancy Faeser. Wissen Sie, wenn ich mir Ihre Anträge so anschaue, dann sehe ich keine Lösungen, dann sehe ich immer nur ein Schüren von Angst.  Liebe Bürgerinnen und Bürger, mir geht es darum, Sie sachlich an den Entscheidungsprozessen der Regierung teilhaben zu lassen.  Migration ist ein ständiger Prozess. Das bedeutet, dass wir als Regierungskoalition gefordert sind, immer wieder auf aktuelle Lagen zu reagieren. Die aktuelle Lage konfrontiert uns gerade mit der herausfordernden Situation des Zustroms von Flüchtenden. Wieder einmal zeigt sich, dass Nancy Faeser darauf reagiert, in enger Abstimmung mit Tschechien und Polen, ebenso wie mit den Bundesländern Sachsen und Brandenburg.  Die zugespitzte Lage an der deutschen Grenze zu diesen beiden Ländern durch die Zunahme von Schleusungen macht jetzt weitere Maßnahmen erforderlich. Die Bundespolizei wird flexible Schwerpunktkontrollen zur Überwachung des Grenzgebietes durchführen, zusätzlich zur Schleierfahndung an den deutschen Schengengrenzen. Diese Kontrollen ermöglichen erst, die bundespolizeiliche Präsenz rasch und vor allem sichtbar zu erhöhen. Nancy Faeser will damit maximalen Ermittlungsdruck auf Schleuser ausüben und ihren menschenverachtenden Geschäftsmodellen einen Riegel vorschieben. Das ist humanitäre Verantwortung, das ist pragmatische Politik.  Wir müssen die Kommunen im Auge behalten. Sie kommen an manchen Orten an ihre Belastungsgrenzen. Sie können Geflüchtete schlicht aus Platzgründen beim besten Willen einfach nicht mehr unterbringen. Das ist nicht flächendeckend so. Es gibt ebenso Kommunen, die noch Kapazitäten frei haben. Mit Blick auf einige Medien bitte ich um sachliche Berichterstattung; denn mit mancher Schlagzeile werden auch hier unnötig Ängste geschürt.  Das eine tun, ohne das andere zu lassen: Wir haben das Chancen-Aufenthaltsrecht geschaffen. Wir haben das Fachkräfteeinwanderungsgesetz auf den Weg gebracht. Wir sind ein Einwanderungsland. Wir wollen, wir müssen eines sein im Hinblick auf den Fachkräftemangel. Erfreulich dazu ist der Report des Instituts der deutschen Wirtschaft Köln. Im Zeitraum 2017 bis 2022 haben wir durch Zuwanderer rund 1,5 Millionen sozialversicherungspflichtige Arbeitskräfte gewonnen – gut für unsere Wirtschaft.  Frau Kollegin, Herr Zippelius aus der Unionsfraktion würde Ihnen gern eine Zwischenfrage stellen. Möchten Sie die zulassen?  Nein.  Das eine tun, ohne das andere zu lassen: Nancy Faeser hat den Aktionsplan gegen Rechtsextremismus maßgeblich gefördert, weil wir wissen, wie sehr es unserer Demokratie schadet, wenn mit Rassismus Politik gemacht wird. Die größte Bedrohung unserer Demokratie kommt immer noch von rechts.  Unsere Innenministerin hat maßgeblich dafür gesorgt, dass wir das Gemeinsame Europäische Asylsystem voranbringen – nach jahrelangem – jahrelangem! – Stillstand.  Wir sind immer noch am Aufräumen.  Auch bei der Ausweisung sicherer Herkunftsländer sind wir maßgeblich vorangekommen. Wir sind jetzt dabei, den Rahmen der Asyl-Krisenverordnung zu verändern, um auch hier auf europäischer Ebene weiterzukommen.  Immer wieder kommt der Ruf nach schnelleren Abschiebungen. Meine Damen und Herren, für Rückführungen sind die Länder zuständig; das hat sich nicht geändert. Im ersten Halbjahr 2023 – das wurde eben schon gesagt – haben wir 27 Prozent mehr Menschen zurückgeführt als im Vorjahreszeitraum. Um die Länder zu unterstützen, hat die Innenministerin den Ausreisegewahrsam auf 28 Tage verlängert.  Frau Kollegin, ich muss Sie leider noch mal unterbrechen. Herr Farle würde Ihnen gerne eine Frage stellen.  Nein.  Auch an dieser Stelle bleibt zu erwähnen, dass wir ein sehr gutes und funktionierendes Justizsystem haben. Nancy Faeser ist alles andere als zögerlich. Sie trifft Entscheidungen – Entscheidungen zum Wohle unseres Landes.  Noch eines zum angeblichen fortwährenden Streit zwischen den Koalitionspartnern, von dem immer wieder zu lesen ist. Ich sage Ihnen: Eine Regierungskoalition aus drei Parteien hat Meinungsverschiedenheiten. In einer Demokratie muss es Meinungsverschiedenheiten geben. Kompromissfindung ist der demokratischste aller Prozesse. Dafür sind wir angetreten; das tun wir transparent.  In diesem Sinne: Bleiben Sie demokratisch – zum Wohle unseres Landes!  Vielen Dank für Ihre Aufmerksamkeit.  Zu einer Kurzintervention Herr Zippelius. Bitte.
125	28.09.2023	ID2012510800	Christoph de Vries (CDU/CSU)	Sehr geehrte Frau Präsidentin! Liebe Kolleginnen und Kollegen! Sehr geehrter Herr Präsident des BdV, Dr. Fabritius! Vor genau 70 Jahren wurde das Bundesvertriebenengesetz beschlossen. Das ist eine wirklich beeindruckende Erfolgsgeschichte. Es regelte die Aufnahme von Millionen Heimatvertriebenen, Flüchtlingen und Aussiedlern, die unser Land tatkräftig mit aufgebaut und geprägt haben. Das Gesetz regelt bis heute die Aufnahme und Integration von Zigtausenden Spätaussiedlern, die eine Bereicherung für unser Land und aus unserer Sicht auch durchaus Integrationsvorbilder für andere Zuwanderergruppen sind, liebe Kolleginnen und Kollegen.  Sie haben es richtig gesagt: Das größte Integrationsmotiv dieser Menschen liegt in ihrer deutschen Identität. Die Spätaussiedler kommen zu uns nach Deutschland, weil sie Deutsche sind und weil sie in ihrer ursprünglichen Heimat leben wollen. Und ausgerechnet mit Ausbruch des Ukrainekriegs hat die Bundesregierung einen Kurswechsel in ihrer Aufnahmepraxis hin zu einer restriktiven Aufnahmepraxis vollzogen. Dieser Kurswechsel hatte in dieser Zeit Tausende Ablehnungen zur Folge. Das hat insbesondere die Angehörigen der deutschen Minderheit in der Ukraine und in Russland betroffen, die ganz besonders von Kriegszerstörungen und in Russland auch von Repressionen betroffen sind. Meine Damen und Herren, aus unserer Sicht hätte das so nicht passieren dürfen.  Liebe Kolleginnen und Kollegen, wir hätten uns gewünscht, dass seit Kriegsbeginn nur ein einziges Mitglied der deutschen Bundesregierung bei seinen Besuchen in der Ukraine mal die deutsche Minderheit dort besucht und ein Zeichen der Solidarität gesetzt hätte. Aber auch das ist leider ausgeblieben.  Der zwischenzeitliche Aufnahmestopp für die Spätaussiedler war aus unserer Sicht ein humanitärer Skandal. Wir haben das als Union von Anfang an hier im Bundestag thematisiert und immer ein rasches Umlenken gefordert. Und ich will auch sagen: Vom Deutschlandtempo haben wir ein anderes Verständnis. Zwei Sätze in einem Gesetz zu ändern, das kann auch schneller als in anderthalb Jahren gehen, auch wenn wir uns im Ziel sicherlich einig sind, Frau Bundesbeauftragte.  Wir haben immer Druck gemacht. In der Regierungsbefragung im März hat die Bundesinnenministerin eingelenkt und zugesichert, zur alten Aufnahmepraxis zurückzukehren. Passiert ist dann aber monatelang nichts, obwohl der Druck so groß war, wie Sie es auch beschrieben haben. Aber offensichtlich gab es eben andere Prioritäten. Sei’s drum! Der Gesetzentwurf liegt jetzt vor. Wir können ihn nicht abschließend bewerten; aber wir begrüßen ausdrücklich die geplante Rückkehr zur alten Aufnahmepraxis. Das will ich hier in aller Klarheit sagen. Denn die beiden Kernforderungen der Union, des Bundes der Vertriebenen und der Landsmannschaft der Deutschen aus Russland sind erfüllt: Ein früheres Gegenbekenntnis, das von Betroffenen eben häufig nicht beeinflusst werden konnte, steht einem aktuellen Bekenntnis zum deutschen Volkstum nicht mehr im Weg und führt nicht mehr automatisch zu einer Ablehnung.  Das Zweite, was auch richtig ist: Alle aufgrund eines Gegenbekenntnisses abgelehnten Antragsteller haben einen Anspruch auf die Wiederaufnahme ihres Verfahrens. Auch das ist richtig, meine Damen und Herren.  Denn es ist ja auch nicht in allen Ländern überhaupt möglich, seinen Nationalitäteneintrag heute noch zu ändern. Deswegen ist es auch richtig, dass das Bemühen ausreicht. Dieser Umstand darf nicht zum Nachteil der Betroffenen ausgelegt werden.  Liebe Kolleginnen und Kollegen, wir als Christdemokraten sind seit Jahrzehnten der Garant dafür, dass die Tore für unsere Landsleute, die Spätaussiedler, nach Deutschland offen stehen, und das wird auch so bleiben. Aber ich frage mich an dieser Stelle schon: Wie glaubhaft ist eigentlich die Haltung der Bundesregierung? Wie kann es denn in dieser Situation sein, dass die Bundesinnenministerin die Haushaltsansätze für die Aufnahme der Spätaussiedler auf 5,1 Millionen Euro mehr als halbiert, die Integrationsmittel um 6 Millionen kürzt, und das, obwohl wir doch mehr Spätaussiedler in Deutschland aufnehmen wollen und die Kosten im letzten Jahr noch 16,5 Millionen Euro betragen haben? Das ist ein deutlicher Widerspruch zu diesem Gesetz. Hierauf hätte ich gerne eine Antwort, Frau Bundesbeauftragte.  Kommen Sie bitte zum Schluss.  Ich komme zum Schluss. – Wir werden uns dafür einsetzen, dass diese Kürzungen zurückgenommen werden. Ich hoffe, wir tun auch das gemeinsam. An dieser Stelle haben Sie unsere Unterstützung.  Vielen Dank.  Für Bündnis 90/Die Grünen hat das Wort die Kollegin Katrin Göring-Eckardt.
129	13.10.2023	ID2012904400	Ulrike Schielke-Ziesing (AfD)	Frau Präsidentin! Liebe Kollegen! Verehrte Bürger! Deutschland befindet sich am Limit. Das betrifft nicht nur die Aufnahmekapazität unserer Kommunen und Turnhallen; das betrifft auch unser Sozialsystem: Rente, Arbeit, Gesundheit, Pflege. Die Beiträge der Sozialkassen steigen; sie steigen sprunghaft und in immer kürzeren Abständen. Die Bürger merken das im Portemonnaie, die Unternehmen als zusätzliche Lohnnebenkosten.  Die Beiträge steigen, um die horrenden Sozialausgaben zu finanzieren, die wir nicht hätten, würde die Regierung die Wirtschaft des Landes nicht mit Volldampf gegen die Wand fahren. Die Ursachen dafür sind bekannt: Energiewende, Verkehrswende und, ja, auch die bis heute ungebremste und massenhafte Einwanderung aus aller Welt in unsere Sozialsysteme.  Gerade die Zuwanderung wurde den Bürgern aber seit 2015 als Allheilmittel angepriesen, um die demografische Lücke zu füllen, die Renten zu sichern und den Fachkräftemangel zu beheben.  Was hat man damals alles versprochen? Nach nur sieben Jahren erwirtschafte ein Flüchtling mehr, als er den Staat koste. Derartiger Unsinn wurde von staatsnahen Instituten angeblich errechnet, in Wahrheit jedoch behauptet, weil es der Politik so in den Kram passte. Wie sollte das auch funktionieren? Millionen Zuwanderer aus bildungsfernen Kulturen ohne Sprachkenntnisse, ein großer Teil Analphabeten und überwiegend ohne Ausbildung.  Nun, heute schreiben wir das Jahr 2023 und wissen es genauer: Nicht einmal ein Drittel der Zuwanderer aus den häufigsten Asylherkunftsländern geht einer sozialversicherungspflichtigen Beschäftigung nach; der Rest bezieht nach wie vor Sozialleistungen.  Wer arbeitet, tut das vor allem im Niedriglohnsektor: Rund 40 Prozent aller Beschäftigten dort haben keinen deutschen Pass. Schlecht qualifiziert und ohne Sprachkenntnisse – so kann man sich in Deutschland keine eigene Rente mehr erarbeiten, und so trägt man nicht zur Stabilität der deutschen Sozialversicherung bei.  Dennoch und trotz der sichtbaren Misserfolge, trotz der Unsummen, die in fehlgeschlagene Integrationsbemühungen versenkt wurden, und trotz sämtlicher Kollateralschäden für die Bevölkerung werden Sie nicht müde, noch mehr Zuwanderung zu fordern und aktiv zu fördern. Mit anderen Worten: noch mehr von dem, was uns maßgeblich und mit in diese Krise geführt hat. Das, liebe Kolleginnen und Kollegen, versteht draußen keiner mehr.  Ja, es ist richtig: Eine qualifizierte Zuwanderung, vor allem für Mangelberufe, wäre durchaus geeignet, einen positiven Saldo für die Sozialkassen zu schaffen. Aber allein um das zu prüfen, bräuchte es ein entsprechendes Konzept und verlässliche Daten.  Deshalb ist es geradezu erstaunlich, dass wir bis heute kein seriöses Material darüber haben, wie sich die Zuwanderung auf unsere Sozialsysteme auswirkt: Als Entlastung, wie das so oft behauptet wird, oder vielleicht doch als Belastung? Eine nicht ganz unwichtige Fragestellung, wie ich meine.  Die Dänen haben es vorgemacht und sind diese Frage systematisch angegangen. Und nicht nur das: Sie haben unterschieden zwischen Einheimischen, Zuwanderern aus westlichen Ländern, aus nicht westlichen Ländern und aus den sogenannten MENAPT-Ländern; das ist der Nahe und Mittlere Osten, Afrika, Pakistan und entspricht ungefähr auch unseren Asylhauptherkunftsländern.  Die Ergebnisse sind so unerfreulich, wie zu erwarten: Einen positiven Saldo an Beitragsleistungen erwirtschaften nur die Einheimischen und die Zuwanderer aus westlichen Ländern. Schon die Zuwanderer aus nicht westlichen Ländern verursachen netto mehr Kosten als Beiträge. Am unteren Ende rangiert die Gruppe der Zuwanderer aus dem arabischen und afrikanischen Raum als massive Belastung der Sozialkassen. Hochgerechnet auf deutsche Verhältnisse reden wir von Milliardenbeträgen in zweistelliger Höhe.  Liebe Kolleginnen und Kollegen, die Wahrheit ist: Fast alle, die illegal über die Grenzen kamen und noch kommen, werden nicht nur vorübergehend, sondern für immer auf staatliche Transferleistungen angewiesen sein. Die Kosten dafür tragen wir alle.  Dänemark hat daraus seine Lehren gezogen, bekanntermaßen seine Einwanderungspolitik angepasst und insbesondere seine Asylpolitik erheblich verschärft, so wie sich das im Übrigen auch die Bevölkerung hierzulande wünscht – bisher vergeblich. Zumindest aber sollte es doch allen, die hier sitzen, ein Anliegen sein, hier die nötige Transparenz zu schaffen.  Wir als AfD fordern Sie deshalb auf, auch in Deutschland eine dem dänischen Modell entsprechende, fortlaufende wissenschaftliche Evaluation zu starten. Die Bürger haben ein Anrecht darauf, zu erfahren, welchen Beitrag Zuwanderer vergleichsweise zu den sozialen Sicherungssystemen leisten, welcher Mehrwert und welche Kosten dabei entstehen. Das sind alles Fragen, die unsere Bevölkerung brennend interessieren, völlig zu Recht.  Ich möchte mich deshalb gerade an die CDU/CSU wenden, die ja derzeit viele unserer Ideen zur Zuwanderung übernimmt: Zeigen Sie, dass Sie es ernst meinen, und unterstützen Sie diesen Antrag für mehr Transparenz und Ehrlichkeit bei der Zuwanderung.  Vielen Dank.  Die Kollegin Rasha Nasr hat das Wort für die SPD-Fraktion.
131	19.10.2023	ID2013111900	Dr. Ottilie Klein (CDU/CSU)	Sehr geehrte Frau Präsidentin! Liebe Kolleginnen und Kollegen! Schwarzmalen, Mut nehmen, Angst machen – das ist das Programm der AfD.  Sie erzählen düstere Geschichten vom wirtschaftlichen und sozialen Abstieg, Geschichten voller Unwahrheiten, die den Menschen das Gefühl geben, von der Politik im Stich gelassen zu werden. Schauen wir uns diese Geschichten doch mal genauer an.  Geschichte Nummer eins: Deutschland ist ein Land im Niedergang. – Ja, die Wirtschafts- und Arbeitspolitik der Ampel lässt zu wünschen übrig. In diesem Jahr wird die Wirtschaft erstmals wieder schrumpfen. Aber stimmt der pauschale Abgesang der AfD auf Deutschland?  Zumindest für 16 Jahre unionsgeführte Bundesregierung können wir festhalten: Die Arbeitslosigkeit hat sich halbiert.  Löhne und Renten sind kontinuierlich gestiegen. Das Bruttoinlandsprodukt ist bis auf zwei Krisenjahre stetig gewachsen.  Aber ja, es gibt Herausforderungen,  denen wir uns stellen müssen. Eine davon ist das Armutsrisiko. Was antwortet eigentlich die AfD darauf? Tja, nicht viel. Sie klagen über kleine Renten und wollen gleichzeitig 20 000 Euro pro Kind aus der Rentenkasse nehmen. Sehr geehrte Damen und Herren, das ist reinster Sozialpopulismus.  Geschichte Nummer zwei: Die EU macht uns arm; deshalb muss sie zerstört werden. – Ja, nicht jede Regulierung auf europäischer Ebene ist sinnvoll. Die Wahrheit ist aber: Kein Land profitiert mehr von der EU als Deutschland.  Mehr als die Hälfte aller Exporte geht in die EU, und jeder vierte Arbeitsplatz hängt vom Export ab. Wer will, dass die EU stirbt, der arbeitet an einem Verarmungsprogramm für Deutschland,  übrigens garniert mit ekelhaftem Antisemitismus des EU-Spitzenkandidaten der AfD.  Geschichte Nummer drei: An allem Übel sind die Zuwanderer schuld. – Ja, irreguläre Migration muss begrenzt werden.  Neben Humanität braucht es in der Migrationspolitik auch Ordnung und Steuerung.  Die Ampel macht hier wahrlich keine gute Figur. Fakt ist aber: Deutschland braucht Fachkräfte, auch aus dem Ausland.  Der Fachkräftemangel bedroht unsere Wirtschaft und damit auch unseren Sozialstaat.  Das hat die AfD nicht verstanden. Sie vermischt wild Asyl, irreguläre Migration und Fachkräftezuwanderung.  Ihr alles durchziehender Rassismus heizt den Fachkräftemangel weiter an.  Er gefährdet unsere Wirtschaft, und nicht nur das: Er schürt auch auf unverantwortliche und inakzeptable Art und Weise Angst und Hass.  Sehr geehrte Damen und Herren, lassen Sie sich von der AfD keine Geschichten erzählen.  Wenn es eine Partei gibt, der unser Vaterland herzlich egal ist, dann ist es die AfD.  Vielen Dank.  Für die FDP-Fraktion hat das Wort Jens Teutrine.
