70	24.11.2022	ID207001500	Peter Aumer (CDU/CSU)	Vielen Dank, Frau Präsidentin. – Herr Kurth, Sie hätten eigentlich in Ihrer Rede die Möglichkeit gehabt, all diese Dinge anzuprechen.  Sie haben fünf oder sechs Minuten genutzt, um auf die CDU/CSU zu schimpfen.  Das zeigt auch, wie wenige Argumente Sie haben.  Vielleicht ganz kurz zu den angesprochenen Punkten: Wir hatten ein sehr intensives Gespräch mit Andrea Nahles. Sie hat gesagt, dass der Titel zu den  ukrainischen Flüchtlingen auch dann nicht ausgereicht hätte, wenn er nicht gekürzt worden wäre. Sie hätten nicht nur die Kürzung rückgängig machen müssen,  sondern Sie hätten sogar aufstocken müssen. In Bezug auf die Verwaltungskosten sollten Sie doch bitte auch einmal schauen, dass die Inflation auch bei der  Bundesagentur für Arbeit ein wichtiger Punkt ist. Die 200 Millionen Euro reichen da also auch nicht aus. Deswegen, Herr Kurth: Bleiben Sie bei der Wahrheit und  schauen Sie, dass Sie dieses wesentliche, wichtige Feld für die Integration von ausländischen Menschen, von Zuwanderern auch entsprechend verantwortungsvoll  finanziell ausstatten.  Zum Thema „Arbeitswelt im Wandel“. Es sollte der kompletten Regierung zu denken geben, wenn man die für die Transformation der Wirtschaft vorhandenen  Mittel nicht ausschöpft und das so begründet: Weil nicht ausgeschöpft wird, müssen wir kürzen. Das ist, denke ich, ein Widerspruch in sich.  Dann soll das Bundesarbeitsministerium stärker daran arbeiten und Impulse geben. Das wäre, glaube ich, viel wichtiger.  Herzlichen Dank.  Nächster Redner: für die SPD-Fraktion Dr. Martin Rosemann.
70	24.11.2022	ID207009300	Martin Gerster (SPD)	Frau Präsidentin! Werte Kolleginnen und Kollegen! Sehr geehrte Frau Ministerin Nancy Faeser! Es ist gerade einmal sieben Wochen her, da haben wir  hier über den Regierungsentwurf für den Haushalt 2023 diskutiert. Was haben wir uns alles anhören müssen von der Opposition! Einerseits wurde von der Union  immer betont, die Schuldenbremse müsse unbedingt eingehalten werden; andererseits hieß es von allen Seiten: Hier zu wenig, da zu wenig, und sowieso ist alles ja  ganz fürchterlich.  Heute steht fest: Trotz auslaufender Coronakonjunkturpakete – was ja absehbar und planmäßig war – stehen 13,1 Milliarden Euro für innere Sicherheit,  Integrationspolitik, Digitalisierung, Sport und Bevölkerungsschutz bereit; das sind 1,8 Milliarden Euro mehr als in der ursprünglichen Finanzplanung. Liebe  Kolleginnen und Kollegen, ich finde, das ist ein sehr, sehr gutes Ergebnis.  Die Hälfte des Etats für 2023 ist für die Sicherheitsbehörden vorgesehen. Das Bundesinnenministerium und die nachgeordneten Behörden erhalten 1 607  zusätzliche Stellen. Schon im Regierungsentwurf waren noch einmal 1 000 zusätzliche Stellen bei der Bundespolizei vorgesehen, zum Schutz der Flug- und Seehäfen,  zum Grenzschutz und zur Verstärkung der Schiffsbesatzung in Nord- und Ostsee. Das ist richtig und notwendig. Ich kann die Kritik von Friedrich Merz und der  Union am Stellenaufwuchs, ehrlich gesagt, überhaupt nicht nachvollziehen; denn es ist wichtig, dass wir hier was tun.  Liebe Kolleginnen und Kollegen, Sicherheit und Zusammenhalt in der Zeitenwende, das war der Ansatz der Ampel in den Beratungen und bei vielen  Gesprächen rund um den Haushalt. Ich möchte mich hier bei Jamila Schäfer und Thorsten Lieb für die sehr, sehr gute Zusammenarbeit ganz, ganz herzlich  bedanken.  Allein in der Bereinigungssitzung haben wir mit 58 Anträgen und 11 Maßgabebeschlüssen viel bewegt, sodass wir heute guten Gewissens sagen können: Die  Innenpolitik ist klar Gewinnerin der Haushaltsverhandlungen.  Für die innere Sicherheit und die Cyberabwehr stellen wir zusätzlich 41 Millionen Euro bereit. Seit Putins Angriff auf die Ukraine hat sich  beispielsweise auch die Sicherheitslage im Ostseeraum massiv verändert. Im Haushaltsausschuss haben wir auf Initiative der Ampel 21 Millionen Euro zusätzlich  mobilisiert für Kontroll- und Streifenboote, aber auch für Mehrzweckboote, darüber hinaus 4 Millionen Euro für die Beschaffung von Drohnen zum Schutz von  kritischer Infrastruktur. Das Bundesamt für Sicherheit in der Informationstechnik kann für 1 Million Euro zusätzlich eine Austauschplattform zu Cyberangriffen  aufbauen und erhält noch einmal 52 zusätzliche Stellen, vor allem zur Stärkung der IT-Sicherheit in unserem Land. Liebe Kolleginnen und Kollegen, das halten wir  für absolut notwendig; das ist richtig investiertes Geld.  Mit dem Haushalt 2023 stellen wir als Ampelkoalition auch 75 Millionen Euro für ein Bundesaufnahmeprogramm für Afghanistan bereit. Wir unterlegen  damit den Plan der Bundesregierung, monatlich etwa 1 000 Menschen mit ihren Familien aus Afghanistan nach Deutschland zu holen.  Das ist ein wichtiges Signal, dass wir Verantwortung übernehmen für Afghanistan und die Menschen.  Wenn ich über Menschen spreche, dann will ich sagen, dass es uns auch ein großes Anliegen war, die Migrationsberatungsstellen für erwachsene  Zuwanderer zu stärken und nicht zu schwächen. Plus 24 Millionen Euro an dieser Stelle sind richtig gut, damit auch die Beschäftigten Planungssicherheit  bekommen.  Bei den Integrationskursen gibt es ein Plus von 153 Millionen Euro; das ist, glaube ich, auch sehr gut; denn nur mit entsprechenden Mitteln kann der  hohe Bedarf, beispielswiese an Sprachkursen, im nächsten Jahr gedeckt werden.  Liebe Kolleginnen und Kollegen, ich freue mich auch sehr, dass wir mit unseren Beschlüssen zum Haushalt 2023 die Investitionen in den Zivil- und  Katastrophenschutz auf sehr hohem Niveau fortführen.  104 Millionen Euro haben wir in der Ampel zusätzlich für BBK und THW mobilisiert. Das THW beispielsweise profitiert davon enorm. Die SB-Mittel bleiben  auf Rekordniveau: plus 12,5 Millionen Euro. Die Aus- und Fortbildung wird deutlich gestärkt, auch die THW-Jugend. Ich glaube, das ist das richtige Signal an die  Familie des THW. An dieser Stelle möchte ich einmal allen Einsatzkräften, egal ob haupt- oder ehrenamtlich, ganz herzlich danken.  Beim BBK, lieber André Berghegger, machen wir viel, da haben wir noch mal viel bewegt, auch in der Bereinigungssitzung: plus 5 Millionen Euro für Cell  Broadcast und ein Sirenenförderprogramm im Umfang von 30 Millionen Euro.  Aber ich finde es auch gut, dass wir die Länder jetzt zwingen, sich daran finanziell entsprechend zu beteiligen; denn ich habe, ehrlich gesagt, die  Schnauze ein bisschen voll, dass wir als Bund für Aufgaben zahlen, die die Länder eigentlich übernehmen sollten, und wir als Dankeschön dann noch harsche  Kritik, beispielsweise aus Düsseldorf oder Stuttgart, bekommen.  Das kann so nicht bleiben; deswegen haben wir eine entsprechende Sperre vorgesehen.  Liebe Kolleginnen und Kollegen, für uns in der Ampel gehört zur inneren Sicherheit auch das Thema „wirksame Prävention und politische Bildung“. Ich  freue mich wirklich sehr, dass wir die Bundeszentrale für politische Bildung noch einmal deutlich stärken konnten, mit plus 12,4 Millionen Euro und 21 Stellen.  Das ist gut für die Bekämpfung von Rechtsextremismus und Rassismus. Das ist auch gut, um beispielsweise Desinformationskampagnen besser entlarven zu können.  Ich freue mich im Übrigen auch sehr, dass wir es geschafft haben, Initiativen zur Stärkung des jüdischen Lebens in Deutschland und für den Kampf gegen  Antisemitismus noch einmal, mit plus 21 Millionen Euro, zu stärken.  Zusammenhalt in der Zeitenwende, dafür steht bekanntermaßen auch der Sport. Gut, dass das Förderprogramm „ReStart“ für den Breitensport, das auf  Initiative von Nancy Faeser der Bund in diesem und im nächsten Jahr mit insgesamt 25 Millionen Euro finanziert, jetzt startet. Weil es nach der Pandemie auch  beim Sport vieles aufzuholen gilt, haben wir weit über den Zuständigkeitsbereich des Bundes hinaus den Sport nochmals deutlich gestärkt: für das IAT in Leipzig  plus 1,5 Millionen Euro, für den Behindertensport plus 1,25 Millionen Euro, für „Campus Sportdeutschland“ in Frankfurt plus 400 000 Euro, für die Sanierung der  Rennschlitten- und Bobbahn in Altenberg plus 1,75 Millionen Euro und zu guter Letzt natürlich die Finanzierung einer weiteren Scheibe des sehr erfolgreichen  Bundesprogramms zur Sanierung kommunaler Sportstätten in Höhe von 400 Millionen Euro.  Das ist sehr, sehr gut angelegtes Geld, wie ich finde, wenngleich es haushalterisch natürlich über einen anderen Einzelplan dargestellt wird.  Zusammenfassend will ich sagen: Es ist uns mit unseren Beschlüssen im Haushaltsausschuss gelungen, dass das Bundesinnenministerium und die  nachgeordneten Behörden für die großen Herausforderungen gut aufgestellt sind. Ich wünsche der Bundesregierung und der Ministerin Nancy Faeser und ihrem Team  und den Behörden von Herzen viel Erfolg bei der Umsetzung des Etats 2023.  Herzlichen Dank.  Eine kleine Anmerkung, Kollege Gerster: „Ehrlich“ oder „nicht ehrlich“, parlamentarische Ausdrucksweise geht anders.  Das Wort hat der Abgeordnete Marcus Bühl für die AfD-Fraktion.
73	01.12.2022	ID207306300	Jörn König (AfD)	Sehr geehrte Frau Präsidentin! Sehr geehrte Kollegen! Und vor allem: Liebe Familien! Vorab erst mal: Liebe SPD, lieber Herr Schrodi, seit 100 Jahren  regiert die SPD in diesem Land mit, und das Ergebnis ist, dass jedes fünfte Kind in Armut lebt.  Schreiben Sie sich das mal hinter die Ohren!  Deutschlands Wirtschaft hat sich in den letzten 60 bis 80 Jahren an ständige Zuwanderung gewöhnt. Zuerst kamen 14 Millionen Deutsche als  Kriegsflüchtlinge aus dem Osten. Dann sorgte die DDR bis 1961 für ständigen Zustrom gut ausgebildeter Leute. Nach dem Mauerbau war damit Schluss, und man  begann, bei anderen Völkern nach Arbeitskräften zu suchen. Italiener, Spanier, Griechen, Türken, Jugoslawen und viele andere kamen.  Nach der Maueröffnung ging das Ganze mit den Osteuropäern weiter, und es wurden alle, die mal irgendeinen Deutschen im Stammbaum hatten, ins Land  geholt.  Ab 2015 hat man die Staatsgrenzen aufgegeben und Syrer, Afghanen und Nordafrikaner in Massen hereingelassen.  In der Tendenz wurden die Zuwanderer immer kulturferner. In dieser langen Zeit haben die Deutschen verlernt, genügend eigene Kinder zu bekommen und  aufwachsen zu lassen.  Heute haben fast 40 Prozent der Kinder einen Migrationshintergrund. Eine Gesellschaft, die so viel Zuwanderung zulässt, entwickelt sich nicht mehr.  Nein, sie wird von außen verändert.  Die propagierte Lösung der alten Parteien besteht darin, einfach weiter alle reinzulassen und dann zu hoffen, dass die benötigten Fachkräfte unter den  massenhaft Zugewanderten sind.  Wir sollen also einfach die Kinder und Jugend von anderen Völkern wegnehmen, damit diese für uns arbeiten. Wir nehmen also anderen Ländern die  Fachkräfte aus völlig egoistischen Gründen weg.  Diese Politik ist – man muss es so sagen – parasitär. Fakt ist: Es kommen mehrheitlich keine Fachkräfte, sondern Profiteure unseres Sozialstaates.  Eine Frage wurde fast nie gestellt: Warum haben wir in Deutschland eigentlich zu wenig Kinder?  Das ist ganz einfach zu erklären: Kinder sind in einer industriellen Eigentumsgesellschaft für den Erwerb von Eigentum und Geld eher hinderlich, da  für sie Geld, Zeit und andere Ressourcen benötigt werden. Kinder sind in einem Sozialstaat mit Rentenversicherung, a) eine Einkommensquelle für die  transferabhängige Unterschicht, b) ein finanzielles Risiko für die Mittelschicht und c) kein Problem für die Oberschicht. In der Unterschicht haben wir  inzwischen Hartz-IV-Dynastien mit vielen Kindern, die Mittelschicht verzichtet häufig aus finanziellen Gründen auf ein zweites und drittes Kind, und die  Oberschicht bekommt so viele Kinder, wie sie möchte.  Die Lösung der Alternative für Deutschland ist eine humane Alternative zum parasitären Menschendiebstahl der alten Parteien.  Die Lösung heißt: mehr Kinder. Daher wollen wir mit unseren Anträgen zum Familiensplitting Familien mit zwei und drei Kindern finanziell  besserstellen –  Kommen Sie bitte zum Schluss.  – als die Lebensmodelle „Single“ und „zwei Verdiener ohne Kinder“.  Herr König, kommen Sie bitte zum Schluss. Letzter Satz.  Ich komme zum Schluss. – Wenn uns in der Familienpolitik keine Kehrtwende gelingt, dann hat Thilo Sarrazin recht gehabt, und Deutschland schafft  sich ab.  Vielen Dank für Ihre Aufmerksamkeit.  Für die SPD-Fraktion hat nun das Wort Leni Breymaier.
73	01.12.2022	ID207306400	Leni Breymaier (SPD)	Danke. – Frau Präsidentin! Liebe Kolleginnen und Kollegen! Wer drei Kinder hat und 100 000 Euro im Jahr bekommt, zahlt keine Steuern mehr. – Hört  sich nett an, ist aber hinterhältig.  Die AfD missbraucht den Begriff „Familie“, um die Gleichberechtigung zu untergraben.  Sie will das Ehegattensplitting erweitern und nennt dies wohlklingend „Familiensplitting“. Neu ist das nicht wirklich. Es folgt natürlich, ohne  irgendeine Nähe zu vermuten, total zufällig der nationalsozialistischen Ideologie, mithilfe von Steuerpolitik Frauen aus dem Erwerbsleben fernzuhalten.  Die Worte, die Sie in Ihren Reden benutzen, unterstreichen das auch. Das kommt aus der rechten Ecke alle paar Jahre hoch wie das Ungeheuer von Loch  Ness – von ganz unten.  Mit Berücksichtigung der wechselseitigen Unterhaltsverpflichtung wollen wir das Ehegattensplitting abschaffen, weil es die Partnerin – in aller  Regel – mit geringerem Einkommen geradezu motiviert, keiner bezahlten und sozialversicherten Erwerbsarbeit nachzugehen. Es unterstützt das überholte  Familienbild: Die Frau kümmert sich um Kinder, Küche und manchmal auch noch um Kirche.  Frau Breymaier, erlauben Sie eine Zwischenfrage des Kollegen Gottschalk aus der AfD-Fraktion?  Nein.  Da viele Leute keine Einkommen- bzw. Lohnsteuer zahlen, weil sie schlicht zu wenig Lohn haben, würde ihnen eine weitere Steuersenkung durch ein  Familiensplitting eben nicht helfen. Für hohe Einkommen wäre es aber eine deutliche und spürbare Steuersenkung. Allerdings würde sich der fiskalische Effekt,  also Steuermindereinnahmen, mit dem dann fehlenden Geld für Betreuung – Krippe, Kita, Schulen usw. – kreuzen. Wir haben es gehört: Über 67 Milliarden würden  dafür fehlen. Und am Ende würde noch verstärkt, was jedenfalls wir nicht wollen: Kinder und Frauen bleiben zu Hause. Das ist der eigentliche Hintergrund des  AfD-Antrags. Das ist alles ziemlich durchschaubar.  In Deutschland werden Ehepaare derzeit gemeinsam besteuert. Dadurch entsteht ein Splittingvorteil, der umso größer ist, je weiter die Einkommen  auseinanderliegen. Ich war letzte Woche bei einem Vortrag von Professor Marcel Fratzscher beim Deutschen Frauenrat. Er hat glasklar dargestellt, wie sich die  Elemente der gemeinsamen Besteuerung, also auch unser Ehegattensplitting,  in den Einkommensteuergesetzen von 17 europäischen Ländern und auch der USA auswirken: Je mehr gemeinsam besteuert wird, desto weniger  Erwerbsarbeitsstunden haben die Frauen. Das sind zum Beispiel in Belgien 339 Stunden und in Deutschland 279 Stunden weniger im Jahr. In Ländern, die kein oder  wenig Splitting haben, sieht es hingegen anders aus: In Norwegen sind es 38 Stunden und in Schweden null Stunden. Alleine durch das Ehegattensplitting arbeiten  die Frauen hierzulande fast 280 Stunden weniger im Jahr.  Was das für den Arbeitsmarkt, für den Fachkräftemangel, für den Arbeitskräftemangel heißt, muss ich hier wohl nicht erklären.  Aber was ich schon erklären will, ist, was das für die Renten der Frauen heißt: In Estland beträgt die Rentenlücke von Frauen und Männern 2 Prozent,  in Dänemark 7 Prozent, in Großbritannien 34 Prozent und in Deutschland 37 Prozent.  Das sind auch Auswirkungen dieser Steuersplittinggesetzgebung.  Deshalb können wir froh sein, wenn wir hier ein paar Zuwanderinnen und Zuwanderer haben,  die auch mal unsere Renten zahlen, meine lieben Kolleginnen und Kollegen. Es bringt uns hier nicht weiter, Reiche zu bevorzugen. Wir sind auf dem  richtigen Weg mit dem Recht auf Ganztagsbetreuung in der Grundschule, mit der Erhöhung des Kindergeldes, mit der Beibehaltung der Kinderfreibeträge, mit der  Kindergrundsicherung. Das sind die Themen, an denen wir arbeiten. Das sind die Themen, die Familien vorwärtsbringen.  Familiensplitting, das hört sich nett an. Aber nett ist halt doch nur die kleine Schwester von … Sie wissen schon.  Wir wollen mit dem Steuerrecht Einkommen möglichst gerecht besteuern und nicht Rollen verteilen. Es ist also klar, dass wir den Antrag ablehnen, wie  letztes Mal. Künftig können wir die Reden von der AfD aus dem letzten Protokoll kopieren und einfügen. Dann könnten wir uns viel Zeit ersparen.  Zu einer kurzen Kurzintervention erteile ich das Wort dem Kollegen Kay Gottschalk.
75	14.12.2022	ID207516500	Martin Hess (AfD)	Frau Präsidentin! Meine Damen und Herren! Ece war ein 14‑jähriges Mädchen, das ihr ganzes Leben noch vor sich hatte. Wie alle Mädchen in diesem Alter hatte sie bestimmt viele Träume und Pläne für die Zukunft. Ihre Mutter hat sie als Mädchen beschrieben, das immer lächelte und immer fröhlich war – so bestimmt auch an jenem Morgen des 5. Dezember, als sie unbekümmert mit ihrer Freundin zur Schule ging. Ece und ihre Familie haben darauf vertraut, dass in unserem Land Kinder auf dem Weg zur Schule sicher sind. In einem funktionierenden Staat mit einer verantwortungsvollen Regierung sollten sie das auch sein. Doch leider ist das nicht der Fall. Die Eltern können Ece nicht mehr in den Arm nehmen, weil sie auf dem Schulweg in der kleinen baden-württembergischen Gemeinde Illerkirchberg von einem Asylbewerber aus Eritrea mit einem Messer bestialisch ermordet wurde.  All die Hoffnungen und Wünsche eines Mädchens und ihrer Familie wurden unwiederbringlich zerstört. Ich vermag als Vater eines elfjährigen Sohnes nicht zu ermessen, welche unsägliche Trauer und welch unerträgliches Leid die Eltern und Verwandten von Ece empfinden und ertragen müssen. Ich kann den Eltern, Geschwistern und Angehörigen aber aus tiefstem Herzen versichern, dass wir als AfD-Fraktion in dieser schweren Zeit an ihrer Seite stehen und echtes, tiefes Mitgefühl empfinden.  Ich will aber auch klar zum Ausdruck bringen – diese Botschaft richtet sich an die Regierung und an die anderen Fraktionen in diesem Haus –, dass sich unsere Gemütslage nicht nur auf Mitgefühl beschränkt. Nicht nur ich als Vater und Sicherheitspolitiker, sondern auch sehr viele Eltern und Großeltern in diesem Land sind wütend, fassungslos und mit ihrer Geduld am Ende, weil sich Eces Tod in eine Vielzahl von Morden mit Messern und Macheten durch sogenannte Flüchtlinge einreiht, die allesamt mit einer verantwortungsvollen Sicherheits- und Migrationspolitik hätten verhindert werden können.  Man muss es klar und deutlich aussprechen: Die Migrationspolitik dieser Bundesregierung tötet Menschen in unserem Land, und damit muss endlich Schluss sein!  Wenn wir in diesen Staat nicht mal mehr gewährleisten können, dass unsere Kinder auf dem Schulweg vor Mördern sicher sind, dann ist das nicht mehr nur ein sicherheitspolitisches Totalversagen, dann ist das eine Schande für unser Land, und diese Bundesregierung sollte sich schämen.  Dass die Innenministerin nach diesem grausamen Messermord auch noch die Abschiebung eines verurteilten afghanischen Sexualstraftäter verweigert, der 2019 in der Flüchtlingsunterkunft von Illerkirchberg an einer Gruppenvergewaltigung beteiligt war und genau diese Gemeinde jetzt gezwungen ist, diesen gefährlichen Verbrecher bei sich unterzubringen, übersteigt das Maß des Erträglichen und Zumutbaren bei Weitem. Empathie- und verantwortungsloser geht es nicht mehr. Schlimmer kann man als Innenministerin seine Verachtung gegenüber der eigenen Bevölkerung nicht mehr zum Ausdruck bringen.  Wer trotz all der von sogenannten Zuwanderern begangenen Morde in unserem Land diese todbringende Migrationspolitik nicht sofort korrigiert, der – das sage ich in aller Deutlichkeit – kann sich seine geheuchelte Anteilnahme und die immer wiederkehrenden Beileidsbekundungen sparen.  Wie viele Väter, wie viele Mütter, wie viele Kinder müssen in diesem Land denn noch sterben, bis diese Regierung endlich reagiert?  Wir wollen keine Worte mehr hören; wir wollen endlich Taten sehen. Schaffen Sie endlich Sicherheit in diesem Land! Dazu bedarf es eben auch einer ideologiefreien Lageanalyse.  Deshalb fordern wir in unserem Antrag eine sofortige Veränderung der Erfassung, in der Polizeilichen Kriminalstatistik eine klare bundesweite Aufschlüsselung der Messertäter nach Nationalitäten und zusätzlich bei deutschen Messertätern eine Darstellung des Migrationshintergrundes, und zudem wollen wir auch eine bundesweite Erhebung der Anzahl und Nationalität der Opfer; denn das ist zwingend erforderlich, um die Messerkriminalität differenzierter und gezielter bekämpfen zu können.  Dass das nicht schon längst umgesetzt ist, zeigt, dass es Ihrer Regierung nicht um Aufklärung, sondern offensichtlich eher um Vertuschung der wahren Ursachen für die grassierende Messerkriminalität in unserem Land geht. Denn in Baden-Württemberg haben wir diese Aufschlüsselung schon längst, und diese Zahlen sind verheerend. Dort gab es bei den Messerdelikten 2021 einen nichtdeutschen Täteranteil von über 55 Prozent, und davon waren 38 Prozent Asylbewerber und Flüchtlinge. Das belegt, dass es sich bei Gewalttaten mit Messern zum überwiegenden Teil um importierte Kriminalität handelt; das ist ein untragbarer Zustand.  Aufgrund der bisher bereits vorliegenden Zahlen ist eines völlig klar – die AfD fordert dies seit Jahren –: Effektiver Grenzschutz und Abschiebungen retten Leben. Viele der Messermörder hätten gar nicht erst in unser Land gelassen werden dürfen oder müssten schon längst abgeschoben sein. Deshalb muss jetzt beides sofort umgesetzt werden. Das sind wir Ece und den unzähligen anderen Opfern schuldig.  Wer jetzt immer noch untätig bleibt, der handelt gewissenlos und pflichtvergessen und trägt eine Mitverantwortung an zukünftigen Messermorden.  Das Wort hat die Kollegin Simona Koß für die SPD-Fraktion.
