10	12.01.2022	ID201005000	Dr. Ann-Veruschka Jurisch (FDP)	Sehr geehrte Frau Präsidentin! Sehr geehrter Herr Bundeskanzler! Die Ampelpartner haben sich eine neue Migrationspolitik vorgenommen, die auf der einen Seite die irreguläre Migration reduzieren will und auf der anderen Seite reguläre Migration ermöglichen und verstärken möchte. Ein ganz wichtiger Aspekt dabei ist die Arbeitskräfteeinwanderung.  Wir haben in Deutschland einen großen Fachkräftemangel: in der Pflege, im Handwerk, in der Gastronomie, in ganz verschiedenen Bereichen. Das werden wir allein aus dem Inland heraus nicht beheben können. Experten gehen davon aus, dass wir zwischen 400 000 und 500 000 Zuwanderer in den Arbeitsmarkt im Jahr benötigen werden. Deswegen meine Frage an Sie, sehr geehrter Herr Bundeskanzler: Welche Maßnahmen planen Sie, um mehr Menschen in den deutschen Arbeitsmarkt hineinzuholen? – Vielen herzlichen Dank.
18	18.02.2022	ID201805500	Marc Bernhard (AfD)	Frau Präsidentin! Meine Damen und Herren! Laut Hans-Böckler-Stiftung fehlen seit Jahren über 2 Millionen bezahlbare Wohnungen. Dass es in Deutschland zu wenige Wohnungen gibt, hat im Wesentlichen drei Gründe:  Es ziehen immer mehr Menschen aus dem ländlichen Raum in die Ballungszentren, und es gibt immer mehr Singlehaushalte. An diesen Fakten kann die Regierung wenig ändern.  Der dritte Grund ist aber, dass wir in Deutschland jedes Jahr eine Nettozuwanderung von rund 500 000 Menschen haben. Das heißt, jedes Jahr müssen so viele Wohnungen wie für eine Großstadt wie Dresden zusätzlich neu gebaut werden. Das Leibniz-Institut bestätigt, dass die jährlich rund 300 000 fertiggestellten Wohnungen allein schon für die Zuwanderer benötigt werden. Ohne das Ordnen, Steuern und Begrenzen der Zuwanderung, so wie dies neuerdings, seit sie in der Opposition ist, ja auch die Union fordert, wird es keine Entlastung am Wohnungsmarkt geben.  Und die Regierung tut alles dafür, auch noch die Kosten des Wohnens immer weiter in die Höhe zu treiben: Energiewende, Baustoffwende, Überregulierung, CO2-Steuer, Klimaschutzgesetz, Gebäudeenergiegesetz und andere Klimaabgaben füttern geradezu die grüne Inflation, und das ohne irgendeinen erkennbaren Nutzen.  Über 500 Milliarden Euro in Form von Styropor sind in den letzten Jahren an die Häuser geklebt worden. Und mit welchem Effekt? Mit dem Effekt, dass bei der Herstellung der Dämmstoffe noch mehr CO2 in die Luft geblasen wurde, als wenn wir gar nichts gemacht hätten, und dass die Kosten des Wohnens um weitere 500 Milliarden Euro gestiegen sind.  – Gehen Sie doch einfach mal dorthin.  Der gestrige Wohnungsbau-Tag hat auch klar und deutlich bestätigt, dass der aktuell von der Regierung geplante KfW-40-Standard im Wohnungsbau überhaupt keine nennenswerte CO2-Einsparung bringt, aber die Kosten des Wohnens massiv weiter verteuern wird.  Im Land mit den höchsten Energiepreisen der Welt wird Heizen zum Luxus. Schon 2020 konnten 7,4 Millionen Menschen ihre Wohnungen nicht mehr ausreichend heizen, und nach der Explosion der Energiepreise in diesem Winter werden noch mehr Menschen frieren müssen.  Auch Ihr lächerlicher einmaliger Heizkostenzuschuss von sage und schreibe 135 Euro ändert daran nichts, zumal diesen ja auch nur gerade mal 600 000 Haushalte von 42 Millionen bekommen, also etwas mehr als ein einziger Haushalt von 100.  Die Menschen brauchen keine Täuschungsmanöver, sondern Lösungen.  Deshalb müssen die Preistreiber bei den Energiepreisen – und das sind nun mal die staatlichen Abgaben und Steuern – weg, so wie es Polen und Italien machen, indem sie die Steuern auf Energie senken, in Italien sogar mit deutschen Steuergeldern aus den Coronahilfen.  Die Abschaffung der Grundsteuer würde die Kosten des Wohnens sofort für alle um 14 Milliarden Euro senken, und die ersten eigenen vier Wände müssen von der Grunderwerbsteuer frei sein.  Wir freuen uns aber ganz besonders, dass Sie von der Union sich unseren Forderungen anschließen und mit Ihrem Antrag auf Bundestagsdrucksache 20/28 endlich ebenfalls „Migration ordnen, steuern und begrenzen“ wollen.  Herzlichen Dank.  Für die SPD-Fraktion hat nun der Kollege Bernhard Daldrup das Wort.
21	17.03.2022	ID202111400	Linda Teuteberg (FDP)	Sehr geehrte Frau Präsidentin! Sehr geehrte Kolleginnen und Kollegen! Der politische Islam, der mit dem Antrag angesprochen ist, ist eine große Gefahr unserer Zeit. Er ist eine ideologische Bewegung, die von der Religion zu unterscheiden ist. Eine Bewegung, die weltweit viel Gewalt, Zerstörung und Destabilisierung hervorbringt. Es ist gerade schon erwähnt worden. Nicht wenige Menschen flüchten vor dem, was der „Islamische Staat“ und andere im Namen dieser Ideologie anrichten. Terroranschläge, Bürgerkriege, zerfallende Staaten, Destabilisierung von Staaten gehören zu seiner schrecklichen Bilanz. Dieser politische Islamismus speist sich aus religiösem Fundamentalismus und politischem Extremismus. Es ist eine Bewegung, die sich gegen unsere westlichen Werte von Freiheit, Demokratie und politischem, gesellschaftlichem Liberalismus wendet.  Er hat viele Phänomene. Zu dieser Bandbreite gehören letztlich Terrorattacken ebenso wie die Anwerbung junger Menschen durch Salafisten, die Abschottung in Parallelgesellschaften und die Ausweitung seines Einflusses in der Gesellschaft. Dabei ist zwischen der Religion des Islam, die es zu achten gilt, deren Ausübung zu gewährleisten ist, und der Ideologie, dem Extremismus, Fundamentalismus andererseits zu unterscheiden. Dieser legalistische Islamismus arbeitet mit vordergründig legalen Mitteln. Mit propagandistischen Mitteln, mit – vordergründig – sozialer Fürsorge und der Betonung von Gemeinschaft will er Einfluss auf Gesellschaften gewinnen. Das könnte man also „legalistischen politischen Islam“ nennen, der mit Öffentlichkeitsarbeit auch in Schulen, Vereinen und anderswo eine Parallelgesellschaft schaffen will. Das ist ein weltweites Phänomen.  Er braucht natürlich auch finanzielle Mittel. Unter dem Deckmantel der sozialen Fürsorge werden enorme Spendenmittel erzielt. Wahr ist aber auch, dass ein nicht unerheblicher Teil der Finanzierung aus dem Ausland kommt. Der letzte Verfassungsschutzbericht ist da sehr deutlich. Dieser politische Islam lehnt einerseits unsere offene, freiheitliche Gesellschaft ab. Gleichzeitig bedient er sich bei seinen Aktivitäten gerade der Freiheitsrechte und der Offenheit unserer Gesellschaft. Religionsfreiheit, Meinungs- und Versammlungsfreiheit sowie kulturelle Toleranz nutzt er für seine Zwecke aus.  Als Verteidiger der offenen Gesellschaft müssen wir klarmachen: Wir sind liberal, aber nicht beliebig und nicht naiv.  Die offene Gesellschaft und den freiheitlichen Verfassungsstaat zu verteidigen, erfordert, ihre Gegner als solche zu erkennen und auch zu benennen. Und da gilt es, zu differenzieren. Lassen Sie uns die Werte der europäischen Aufklärung konsequent gegenüber jedermann vertreten. Religion und Glaubensgemeinschaften sind zu achten, aber sie dürfen auch kritisiert werden. Nicht jede Kritik an islamischem Fundamentalismus ist islamophob.  Allzu oft wird dieser Begriff benutzt, um jede Kritik abzuwehren und Fundamentalismus gegen Kritik zu immunisieren. Ich glaube, es ist auch wichtig, hier zu sagen – so viel Differenzierung muss möglich sein –: Zwischen dem Verdacht des Islamismus, der natürlich nicht auf alle Muslime generell fallen darf, einerseits und dem Benennen realer Integrationsprobleme andererseits zu unterscheiden, ist wichtig. Allzu oft leiden auch liberale Muslime unter diesen Problemen.  Viele Flüchtlinge und Zuwanderer sind gerade wegen des Allmachtsanspruches des politischen Islam zu uns gekommen; sie suchen Freiheit und wollen hier nicht von islamistischen Allmachtsansprüchen eingeholt werden. Terror beginnt übrigens auch nicht erst, wenn es zu Gewaltakten kommt; dem geht oft eine lange Entwicklung voraus. Aber auch gesellschaftlicher Druck und Einschüchterung, die ja zunehmend an Schulen zu beobachten ist, sind ein Problem. Auch das müssen wir angehen.  Wir müssen und wir werden der Radikalisierung und dem Extremismus die Voraussetzungen entziehen. Wir müssen uns auch damit beschäftigen, warum bisherige Präventionsprogramme offenbar nicht erfolgreich genug sind: Der Verfassungsschutz zählt circa 12 000 Salafisten in Deutschland. Wir brauchen dafür, gerade weil es eine so große Herausforderung ist, einen ganzheitlichen Ansatz, ein Handeln der Behörden aus einem Guss und keine Schnellschüsse oder Stückwerk. Wir brauchen die Zusammenarbeit mit allen in der Gesellschaft. Jeder, der diese freiheitlichen Werte infrage stellt und sich nicht integrieren will, kann allerdings auch kein Partner für unsere Integrationsanliegen sein. Der legalistische politische Islamismus will unsere freiheitliche und demokratische Lebensweise auf schleichende Weise aushöhlen. Das wollen und werden wir nicht zulassen.  Vielen Dank.  Zu seiner ersten Rede im Deutschen Bundestag erhält nun der Kollege Ralph Edelhäußer für die CDU/CSU-Fraktion das Wort.
22	18.03.2022	ID202206900	Markus Kurth (BÜNDNIS 90/DIE GRÜNEN)	Frau Präsidentin! Liebe Kolleginnen und Kollegen! Ich finde es ganz wunderbar, dass wir jetzt zum ersten Mal in der neuen Legislaturperiode, in der 20., eine rentenpolitische Diskussion haben. Nur hätte ich mir gerade für die erste Debatte in dieser Legislaturperiode zu diesem Thema eine etwas grundsätzlichere Fragestellung gewünscht als diejenige, die Die Linke hier jetzt anbieten kann.  Die Erhöhung der Mindestreserve in der Nachhaltigkeitsrücklage von 0,2 auf 0,4 Monatsausgaben: Ich weiß nicht, ob da ein Ruck durch die Rentnerinnen und Rentner und Beitragszahler geht, ob das etwas ist, was sie elektrisiert. Ich weiß auch nicht, ob die Wählerinnen und Wähler der Linken dadurch jetzt in Scharen an die Urnen getrieben werden. Aber das ist ja nun Ihre Sache.  Ich weiß nicht, ob Ihnen nach der Wahl eine Kommunikationsreferentin oder ein Kommunikationsreferent abhandengekommen ist oder ob Sie so eine Stelle jemals besetzt hatten. Jedenfalls haben Sie selber gemerkt, dass die rein technische Substanz Ihres Gesetzentwurfes nur eine ziemlich kleine Baustelle darstellt. Deswegen, Herr Birkwald, haben Sie von hier aus auch behauptet, es würden Nullrunden drohen,  was überhaupt nicht der Fall ist.  – Nein. – Es wird eine Rentenerhöhung,  und zwar eine ziemlich kräftige, von über 4 Prozent zum 1. Juli geben. Das ist Tatsache.  Sie haben auch versucht, den Eindruck zu erwecken, als ob die Erhöhung der Mindestreserve irgendeinen Beitrag zur dauerhaften, langfristigen Stabilisierung der Rentenkasse leisten würde. Auch das ist nicht der Fall. Nein, das markiert nur einen etwas höheren Punkt, an dem eine Intervention durch eine Erhöhung des Beitragssatzes notwendig wird. Das ist im Kern ein rein technischer Vorgang, der natürlich auch eine gewisse Substanz hat; das will ich überhaupt nicht bestreiten. Denn in der Tat – das beschreiben Sie in Ihrem handwerklich übrigens guten Gesetzentwurf zutreffend –: Es droht, wenn diese Untergrenze erreicht wird – und sie wird in ein paar Jahren erreicht werden –, die Gefahr, dass die unterjährige Liquidität – so nennt man das – über Beitragseinnahmen nicht gesichert werden kann und dass dann der Bund einspringen muss.  Die Gefahr ist an dieser Stelle natürlich die, dass die Zeitung mit den großen Buchstaben schlagzeilt: Rentenkasse pleite! Nichts mehr übrig! Kann nächsten Monat noch Ihre Rente gezahlt werden? – Ich finde, solche Debatten sollten wir uns tunlichst ersparen –  Herr Kollege.  – sofort – und stattdessen als Koalition darüber nachdenken – noch ist die Rücklage gut gefüllt –, was wir tun können, um diese Situation zu vermeiden.  Jetzt aber. Herr Birkwald würde gerne eine Zwischenfrage stellen. Möchten Sie das zulassen?  Ich habe es schon geahnt.  Wie ist das Ergebnis der Ahnung?  Ja. Bitte.  Schweren Herzens.  Also: Bitte.  Vielen Dank, Frau Präsidentin. – Vielen Dank, lieber Kollege Markus Kurth. Angesichts der Uhrzeit mache ich es extrem kurz.  Sehr geehrter Herr Kurth, Sie haben hier gerade behauptet, es drohten keine Nullrunden. Ich möchte festhalten: Diese Behauptung ist faktenwidrig. In der Herbstschätzung 2021 der Rentenversicherung kann man das gerne nachlesen: „Rentenanpassung ab Juli in Prozent – Alte Bundesländer“, 2024: null.  Genau darum geht es. Es geht nicht um dieses Jahr und auch nicht um das kommende Jahr, sondern es geht darum, dass wir dann, wenn die Nullrunden drohen, also im Jahr 2024, genug Geld in der Nachhaltigkeitsrücklage haben; denn die wird bis dahin von 39 Milliarden Euro auf 8 Milliarden Euro abgeschmolzen sein.  Deswegen frage ich Sie: Sind Sie bereit, das zur Kenntnis zu nehmen? Erläutern Sie uns doch bitte, warum Sie gestern die 500 Millionen Euro gestrichen haben.  Danke.  Wir sehen im Moment, dass die Nachhaltigkeitsrücklage zum Ende des letzten Jahres – das ist noch nicht so lange her – bei 39 Milliarden Euro stand oder 1,6 Monatsausgaben, das heißt noch oberhalb der Monatsausgabe. Es besteht also in dieser Situation, wo wir eine schwerwiegende Unsicherheit gerade auch in der Wirtschaft haben und nicht ganz klar ist, wie es am Arbeitsmarkt weitergeht, ein ausreichender Puffer, um hier nicht aktionistisch handeln zu müssen.  Sie haben mit Ihrer Äußerung gerade insinuiert, es würde quasi unmittelbar eine Nullrunde drohen, und ich habe festgestellt, dass das falsch ist.  Nach dem Jahr 2022, das wir gerade haben, wird das Jahr 2023 kommen, und dann kommt das Jahr 2024. Das heißt, wir haben noch gut zwei Jahre Zeit, vorausschauend zu handeln, und das werden wir als Ampelkoalition auch tun.  Die Formulierungen, Absichten und Zielsetzungen des Koalitionsvertrags in Bezug auf ein dauerhaft stabiles Rentenniveau sind an dieser Stelle ganz eindeutig. Sie wissen, genau wie ich, dass es verschiedene Interventionsmöglichkeiten gibt, und dazu zählt natürlich auch der Bundeszuschuss. Was aber noch viel wichtiger ist: dass wir die langfristigen Grundlagen der Finanzierung im Blick haben. Das bedeutet, dass wir das Erwerbspersonenpotenzial hoch halten müssen, dass wir zum Beispiel die Frauenerwerbstätigkeit fördern müssen, qualifizierte Zuwanderung, aber auch Integration und Ausbildung von Zuwanderinnen und Zuwanderern, die nicht so gut ausgebildet sind, Sprachkurse. Das sind alles Dinge, die im Moment ganz dringend anstehen.  Dann nehmen wir uns vor, dass wir sowohl Arbeitsmarktpolitik, Rehapolitik und Tarifpolitik gemeinsam betrachten. Es werden nämlich in den nächsten zehn Jahren 7 Millionen Menschen ausscheiden, Ältere kommen nach. Erst gestern war in einer Zeitung zu lesen, dass ein Viertel der Beschäftigten über 55 Jahre alt ist. Es geht darum, durch eine Reform im Rehabereich – die Frau Kollegin Machalet hat vorhin schon einige Punkte genannt – die Gesundheit und Arbeitsfähigkeit an dieser Stelle hoch zu halten.  Natürlich haben – meine Kollegin Beate Müller-Gemmeke rief es mir vorhin zu – eine gute Tarifpolitik, eine erweiterte Tarifbindung, vernünftige Lohnabschlüsse und auch eine Erhöhung des Mindestlohns allesamt einen entscheidenden Effekt auf die Rentenversicherung.  Das heißt – ich möchte es kurz skizzieren –, dass Ihr Entwurf nicht die tragenden Strukturpfeiler der Sozialversicherung in den Blick nimmt, sondern einen Mechanismus zur Liquiditätssicherung, was in der Sache überhaupt nicht falsch ist. Wir aber versuchen als neue Regierungskoalition – das kann man mit ein bisschen gutem Willen auch erkennen –, einen ganzheitlichen Blick auf die Rentenfinanzierung zu nehmen, der die verschiedenen Komponenten gleichermaßen bearbeitet. Das ist, wie ich hoffe, deutlich geworden.  Ich freue mich, wenn wir irgendwann, hoffentlich in nicht allzu ferner Zukunft, wieder einmal grundsätzlich über die Perspektiven der Rentenversicherung reden können, die nicht nur eine Säule, sondern das Fundament in unserem Sozialstaat darstellt.  Vielen Dank.
25	24.03.2022	ID202507700	Matthias Helferich (fraktionslos)	Vielen Dank. – Herr Präsident! Es soll nicht unkommentiert bleiben, dass eine Mehrheit hier der AfD und der Linken Vertreter im Parlamentarischen Kontrollgremium verwehren. Sie wollen hier die großen Demokraten sein; doch das Gremium, das den Verfassungsschutz und andere Geheimdienste kontrollieren soll, bekommt keine Vertreter der Oppositionsparteien auf der demokratisch-linken, auf der demokratisch-rechten Seite. Das zeigt: Sie sind Extremisten der Mitte,  und Sie führen die Geheimdienste gegen die Oppositionsparteien in diesem Land ins Felde.  Sie wollen 675 Millionen Euro in Integrationskurse stecken. Als Kommunalpolitiker aus Dortmund weiß ich, dass die Erfolge der Integrationskurse nach der Integrationskursverordnung gar nicht nachgehalten werden. Wir wissen nicht einmal, wer das Sprachlevel B1 erfolgreich abschließt.  Aber das haben Sie auch erkannt und diese Chance genutzt, um Ihrem Milieu wieder etwas Geld zuzupumpen. Die Regierung buttert 13 Millionen Euro in die – Zitat – „Erprobung einer sozialpädagogischen Begleitung von Teilnehmenden in Integrationskursen …“. Konkret wollen Sie also sozialpädagogische Massenzuwanderungsgewinnler dafür bezahlen, dass sie den Müßiggängern mit Migrationshintergrund noch das Händchen dabei halten, wenn diese Deutsch auf Grundschulniveau erlernen. Und das soll Ihre Fachkräftezuwanderung sein?  Das Geld wäre besser in die Rückführung all jener Zuwanderer investiert, die sich lediglich in unsere Kriminalstatistik integriert haben und in Clans organisiert sind.  Sie haben groß angekündigt, Frau Faeser, dass Sie eine umfassende Rückführungsoffensive gegen Clans und kriminelle Ausländer starten wollen. Doch wie meine Anfrage an die Bundesregierung ergab, können Sie nicht beziffern, wie hoch die Abschiebung von Clanmitgliedern und kriminellen Ausländern ist – mein Name ist Ampel, ich weiß von nichts!  Ihre Massenzuwanderungspolitik ist ein Mastprogramm für Clanstrukturen in meinem Heimatland NRW. Das polizeiliche Lagebild des LKA zeigt dies ganz klar. Das libanesische Clan-Establishment hat jetzt schon Angst vor den syrischen und irakischen Clanstrukturen. Wenn Sie es mit der Sicherheit in unserem Lande wirklich ernst meinen, dann starten Sie Ihre Rückführungsoffensive! Ich werde Sie gerne dabei unterstützen.  Vielen Dank, Herr Kollege Helferich.  Bevor Herr Frei protestiert, muss ich die Aussage korrigieren, die Herr Helferich gemacht hat: dass es keine demokratische Oppositionsfraktion im Parlamentarischen Kontrollgremium gebe. Noch jedenfalls, Herr Frei, gehören Sie für mich zur demokratischen Gesamtheit des Parlaments.  Letzter Redner in dieser Debatte ist der Kollege Dr. Lars Castellucci, SPD-Fraktion.
36	08.05.2022	ID203611000	Gülistan Yüksel (SPD)	Sehr geehrte Frau Präsidentin! Sehr geehrte Damen und Herren! Liebe Kolleginnen und Kollegen! Sosehr ich mich über die Gelegenheit freue, über das wichtige Thema der Integration zu sprechen, so sehr bin ich verwundert, dass die Union anscheinend ihr Herz für die zu uns kommenden Menschen entdeckt hat. Lassen Sie mich kurz drei Zitate vorlesen: „Asylurlauber auf Heimattrip können gleich bleiben, wo sie hergekommen sind.“ „Die Migrationsfrage ist die Mutter aller politischen Probleme in diesem Land.“  Wir brauchen ein Einwanderungsbegrenzungsgesetz „mit Vorrang für Zuwanderer aus unserem christlich-abendländischen Kulturkreis“.  Was Sie gerade gehört haben, sind nicht etwa Aussagen der AfD, auch wenn sie klatschen. Nein, es sind Aussagen der letzten Jahre aus den Reihen der Union.  Auch in meiner mehr als 30‑jährigen Integrationsarbeit habe ich viele Blockaden und Ressentiments der Union miterlebt, sei es beim kommunalen Wahlrecht, sei es bei der doppelten Staatsbürgerschaft und der unsäglichen Unterschriftenkampagne hierzu, sei es bei den Debatten zum Zuwanderungsgesetz oder der immer wiederkehrenden Diskussion über eine Leitkultur. Der rote Faden, der sich bei der Union zu Migrationsthemen durchzieht, ist das Narrativ von „Wir gegen die anderen“.  Immer wieder wurde die Integrationsarbeit durch die Union blockiert und erschwert, ob auf kommunaler, Landes- oder Bundesebene.  Wenn die Union das jetzt anders sieht, ist das ganz gut. Ich hoffe nur, dass diese Besserung auch nachhaltig ist  und sich Ihre Solidarität auf alle Geflüchteten und die hier lebenden Menschen erstreckt.  Liebe Kolleginnen und Kollegen, es ist wichtig und richtig, dass wir die zu uns flüchtenden Menschen aus der Ukraine schnell und unbürokratisch aufnehmen und ihnen Zugang zu Sprachkursen und dem Arbeitsmarkt ermöglichen. Es darf aber nicht darum gehen, vor welchem Krieg die Menschen zu uns fliehen. Für alle gilt der Grundsatz: Arbeit, Sprache, Bildung und Begegnung von Anfang an. Wir brauchen daher zum Beispiel auch die Abschaffung von Arbeitsverboten und Kettenduldungen; einige Kollegen sind schon darauf eingegangen.  Ich kann es nicht oft genug sagen: Es darf keine Menschen erster und zweiter Klasse geben.  Sehr geehrte Damen und Herren, Integration ist ein Prozess, ein Prozess, bei dem alle beteiligten Seiten aufeinander zugehen müssen. Wenn wir durch unsere Politik Gemeinschaft und Wertschätzung im Alltag fördern, fordern und stärken, dann kann Integration auch nachhaltig gelingen, dann ist Integration eine Bereicherung für unser Land.  Da die Union anscheinend ihr Herz für die Integration entdeckt hat, freue ich mich schon, zu sehen, wie Sie zukünftig auf unsere Vorhaben reagieren. Wie ich sehe, sind Sie alle mit Ihren Handys beschäftigt. Ich hoffe, dass Sie zugehört haben.  Vielen Dank.  Für die CDU/CSU-Fraktion spricht der Kollege Lars Rohwer.
